帖子链接,标题,正文,标签,发布时间,发布地点,点赞数,收藏数,评论数
https://www.xiaohongshu.com/search_result/692c32d6000000001e00223f?xsec_token=ABPTxI3f4DlW_VS0PuRxolY3X4fYYSUX6Xwa7Fj3_5dZc=&xsec_source=,??Starbucks学兼日记4,感觉可以改成在??闯祸日记了，今天加热错了两个脆皮肠??把脆皮肠当成芝士牛肉三明治??加热了，看了下价签没撤，没过脑子就加热。随行忘记刷了今天，没有什么特别想喝的，姐姐也一直在忙就没好意思说。今天吃的??酸奶碗很好吃，最近心情有些起伏，感觉有点累，想做点有意思的事认识有的人，又没有力气。,"打工日记, 我的大学兼职",11月30日,上海,3,收藏,0
https://www.xiaohongshu.com/search_result/68bbb34c000000001d0166a1?xsec_token=ABHrly2Z7j5NJBG9XCiG5nXDRN-tmjTXoAm0lXwb7ACGo=&xsec_source=,在喧闹的星巴克 反而更易进入心流状态??,"不知道你们有没有同感：每次推开星巴克的门，扑鼻而来的咖啡香夹杂着隐约的谈话声、咖啡机运作的蒸汽声、键盘敲击声……明明那么吵，我却总能奇迹般地沉下心来。 	 有时候在宿舍、在图书馆，反而容易分心――手机一震就想看、身边人一动就想抬头。但在星巴克，那种周围的热闹与我无关的氛围，莫名让我觉得安心。 	 捧着电脑和书坐下，耳机里是轻音乐，手边是一杯热拿铁。啜一口微苦的咖啡，深呼吸，让我感觉很放松。 	 接下来的两三个小时，仿佛进入了一个透明的结界。读文献、写论文、整理笔记……思路异常清晰，效率高到飞起。明明身边有人谈项目、有人聊周末计划、有人打电话，但这些声音仿佛成了背景白噪音，不但不打扰我的思绪，反而让我更沉浸在自己的节奏里。 	 后来我才知道，这叫适宜的背景噪音水平。轻微的环境干扰，反而能激发创造力、提升专注持久度。而咖啡因，更能使大脑保持清醒，它能暂时屏蔽疲劳信号，让我们更容易进入「心流状态」。 	 当决定去星巴克学习，就意味着我主动选择了一段完全属于自己的、不被打断的时间。没有室友突然的聊天、没有床的诱惑、没有反正是在宿舍就随便做做的懈怠感。 	 每次学得差不多了，合上电脑的瞬间，那种成就感真的难以言喻。 抬头看看周围依然嘈杂的环境，心里却特别平静和满足。 	 收拾好东西推门出去，傍晚的风吹过来，伸个懒腰，那种充实又幸福的感觉，是一天中最治愈的时刻。 	 祝愿大家都能学有所成，工作顺利。 知命不惧，日日自新。????","课堂汇报ppt, pre, ppt, 星巴克学习, 心流状态, 学习仪式感, 专注力, studyaccount, 学习日常",9月6日,,3,1,1
https://www.xiaohongshu.com/search_result/69357a9d000000001e008c2e?xsec_token=ABfO4xEEFRIOyxKH1LZyYlnu1dweOjEx1AhJD1kmU6jCQ=&xsec_source=,我天…只有广州才有？,"隐藏在现实世界的巫师们！！ 麻瓜结节即将打破 ?? 九又四分之三站台已对接沙面欧陆街巷，全国首家星巴克沙面店×哈利波特主题魔法屋 	 12/8 邀请你加入魔法庆典！！魔法咖啡","哈利波特, 星巴克, 它唯一的缺点是本地限定, 我来这里只办一件事, 不允许你不知道, 我在星巴克学魔法, 星巴克魔法咖啡, 拍照",昨天 21:01,广东,17,2,8
https://www.xiaohongshu.com/search_result/67de8942000000001b026366?xsec_token=ABEf9BeXNdM2Mmt_6TmjixI4qJHBAXn62KNRxdYPBaqBw=&xsec_source=,星巴克店员热饮烫伤外卖员被判赔3.6亿 （上,"业务持续低落的星巴克最近几年频繁更换CEO， 去年新上任的CEO布莱恩・尼科尔（Brian Niccol）发起了星巴克史上最大规模裁员，裁减人数多达1100人。 	 内外交困的星巴克最近又发生了一件全球瞩目的事情。 	 2020年外卖员迈克尔・贾西亚在洛杉矶某星巴克的得来速取餐时，店员将顾客点的3杯饮品安放在杯托上，打开窗口将其递交给坐在车内等待的迈克尔。在交接过程中，托盘上的一杯热饮因为没有妥善固定意外翻倒，滚烫的咖啡当即淋在了的下迈克尔体和大腿上。 	 迈克尔被紧急送医，后接受了2次皮肤移植手术治疗。经过诊断，受害人因此遭受三度烧伤、毁容及下体神经系统永久性损伤。受害人认为自己遭受了身体疼痛、精神痛苦、生活乐趣丧失、羞辱、不便、悲伤、毁容、身体功能受损、焦虑及情绪困扰等，对星巴克提起了诉讼。 	 经过几年的诉讼，美国加州陪审团于近日裁定，星巴克需向这名外卖员赔偿5000万美元（约合人民币3.6亿元）。如果把利息和律师费考虑在内，这个数字可能会上升到6000万美元。 	 这个数字着实很惊人！ 	 反观在国内，很多制造业企业的工人在工地工厂上因为事故死亡赔偿只有几十万人民币的事件比比皆是。还有传闻很多大货车司机刹不住车的时候宁可撞死人也不强制避让，因为撞死人赔钱比车受损的损失更小。 	 同是人命关天，国内外在人身伤害赔偿金额方面的巨大差异主要源于法律体系、社会文化、经济发展水平等多方面因素。 	 1. 法律体系与赔偿标准 	 国外（以美国为例） 	 惩罚性赔偿：美国法律允许惩罚性赔偿，旨在通过高额赔偿惩罚企业过失，防止类似事件再次发生。星巴克案件中的5000万美元赔偿就包含了对企业过失的惩罚性赔偿。 	 精神损害赔偿：美国法律重视精神损害，受害者可以获得高额赔偿，涵盖身体伤害、精神痛苦、生活质量下降等多方面。 	 陪审团制度：陪审团通常倾向于同情受害者，尤其是在企业明显过失的情况下，赔偿金额往往较高。 	 中国 	 补偿性赔偿：中国法律主要采用补偿性赔偿，赔偿金额通常限于实际损失，如医疗费、误工费等，精神损害赔偿较低。 	 赔偿标准：中国的赔偿标准相对固定，尤其是工伤赔偿，通常依据工资水平和伤残等级计算，金额较低。 	 法律执行：尽管法律规定了赔偿标准，但在实际执行中，劳动者往往处于弱势地位，难以获得应有的赔偿。","热点新闻事件, 新闻, 保护消费者, 热点, 社会新闻, 国际新闻, 社会热点, 星巴克",3月22日,,4,1,0
https://www.xiaohongshu.com/search_result/68f39bd50000000007038cd8?xsec_token=ABG6MEmK92d41ml0cTNwbFNlCjmP5akadg1E4kUtv-1Vc=&xsec_source=,无标题,广州烈士陵园星巴克一楼的店员好帅,,10月18日,,90,26,77
https://www.xiaohongshu.com/search_result/690b46110000000004013f6b?xsec_token=ABjU1Pi5Z_syJjMk7v0uM9Biu-43203MzBMvBz4UJOz-0=&xsec_source=,经观察，我们都是图书馆的固定NPC,我在图书馆两周观察报告：原来大家都是自带设定的固定NPC 1号星巴克续杯姐 总拎着星爸爸杯子去续咖啡 2号活页本哥：桌角堆了3本活页本，红橙蓝荧光笔都是按色排好，是不是有强迫症啊hhh 34号搭子姐妹花：应该是大二的师妹吧，经常中午一起吃三明治，用课本挡着小声聊作业，超努力的样子 5号平板课代表 永远手里握平板看网课，偶尔会啃一口放在桌角的全麦面包，啃完还会擦一下屏幕 日常,"图书馆, 搞笑, 备考, 精神状态良好, 抽象, 泡图书馆, 搞笑日常, 生活",11月5日,,668,61,218
https://www.xiaohongshu.com/search_result/6858fc9000000000150229b3?xsec_token=AB04eIt9DVeWqNHbVPesa97eA3aETuCJLq2AYUtmwMqY0=&xsec_source=,广州大学生自习好去处｜官洲星巴克,WiFi?插座?厕所?地铁官洲站? 价格透明，这家风景还算好，离地铁站特别近。不过商务士（牛马们）偏多，有比较多不愉快的声音…而且我感觉?的桌子太矮了坐一天脖子好累…隔壁有七仔和麦当当,"在咖啡店学习, 学习的地方, 可以学习工作的咖啡店, 考试周, 适合看书学习的好地方, 大学生期末周精神状态, 期末周的精神状态",编辑于 06-23,,13,1,3
https://www.xiaohongshu.com/search_result/6916e698000000001b030a5b?xsec_token=ABW1qqnlActQJuBZ3-7-bDS1mLmSmhqQ-gaWsbqqwDVZo=&xsec_source=,分享一波前期分析――星巴克中国,因为还在自己摸索怎么做公司研究，所以就借助AI工具生成了一个框架 希望能收获大家的见解与指导（也借此机会测试一下可实操性如何）,"商业分析, 行业分析, 行业研究, 市场发展趋势, 行业报告, 星巴克",11月14日,河南,24,23,7
https://www.xiaohongshu.com/search_result/68b11008000000001d037bab?xsec_token=AB1S0cTo54ZWpk3ytW7s2j9HD_hxN-be-r4JpW6rqxCc8=&xsec_source=,在贸大想鉴别同学能力，和TA喝星巴克就够了,"在贸大，想要快速了解身边同学的能力和性格，带 TA 去喝一杯星巴克就够了。不用点得太花哨，就选一款经典饮品 ―― 焦糖玛奇朵 + 提拉米苏，观察 TA 的点单习惯、品鉴方式以及对星巴克的看法。? 那些思维僵化、眼界狭窄的同学，一听到你说 “去喝星巴克”，第一反应往往是嫌弃：“星巴克？不就是卖高价水的吗”“这有什么好喝的，不如去校门口的平价咖啡店”。有些自以为是的同学甚至还会冷笑：“喝这个多没品味啊，我都只喝小众手冲精品咖啡”。? 能力一般的同学，听到你提议喝星巴克，可能会说：“行啊，不过我平时很少喝”。他们只是随大流，对星巴克没什么特别的想法。等你在星巴克搞出点 “花样”，比如用星冰乐搭配曲奇碎、DIY 隐藏喝法火了，他们才会后知后觉地感叹：“原来还能这样？” 还有些平庸的同学会抱怨：“星巴克的咖啡越来越淡了，甜点也太甜，真没意思。” 但真要让他们研究怎么用星享卡积分更划算、怎么搭配饮品和甜点更和谐，他们又懒得动脑。? 能力强的同学，会和你认真讨论星巴克的全球化商业模式、在中国市场的本地化策略，甚至分析为什么美式咖啡能成为跨文化的经典饮品。他们会分享自己的星巴克经验，比如如何用优惠券和积分组合薅羊毛、哪些季节限定新品值得尝试、怎么根据当天的心情和行程搭配饮品温度与甜度。更重要的是，他们不光会说，还会直接行动 ―― 今天和你聊到 “冷萃咖啡加燕麦奶绝配”，明天就约你到学校附近的星巴克门店，点好饮品一起品鉴，而不是只会嘴上说说。毕竟在贸大，“强执行力”是刻在骨子里的专业素养，连喝杯咖啡都不例外。? 至于那些心术不正的同学，当你分享星巴克的隐藏喝法或优惠攻略时，他们表面不吭声，等你在朋友圈晒出 “星巴克神仙搭配” 收获点赞后，他们就开始在背后阴阳怪气：“这算什么？我早就知道了”“肯定是抄小红书上的，还装作自己发现的”。这种人嫉妒心强，见不得别人好，建议趁早远离。要知道在贸大，无论是课堂讨论还是实习合作，真诚分享和互相成就才是主流。? 总之，在贸大想快速了解一个人，带 TA 喝杯星巴克就够了。从点单到品鉴，从吐槽到创意，一杯咖啡的工夫，你就能看清 TA 的能力和品性。愿每一位贸大学子，都能找到既能一起品咖啡聊行业动态，又能一起泡图书馆搞学术、闯职场的靠谱伙伴！? 	 生活分享篇","对外经济贸易大学, 对外经济贸易, 大学, 贸大, 抽象, 大学, 大学生活分享篇, 新生开学",8月29日,,96,26,131
https://www.xiaohongshu.com/search_result/6935ac58000000001e02f3e9?xsec_token=ABfO4xEEFRIOyxKH1LZyYlngUQyj0yvDt55QqOpBUv4v0=&xsec_source=,“一场情绪的逃跑”,"今天周末 去超市采买一通 	 喝了星巴克（香草风味拿铁）有点甜，喝不了苦咖啡的可以尝试它 	 买了一堆零食，零食箱补货啦 	 买了腊梅，上次买的是小雏菊，回家第二天就蔫了，花店老板说让我养养腊梅，如果腊梅也养不活的话，让我放弃养花","考公, 超格, 我的努力好像小狗屁",20小时前,黑龙江,点赞,收藏,0
https://www.xiaohongshu.com/search_result/692e6449000000000d03d14e?xsec_token=ABhCIg4w8CMGOT8Uwk1QeWu0LT6AqkHf0Ab_EE97ivzGo=&xsec_source=,事实的真相：其实你并没有度过糟糕的一天,"我们常常焦虑、不开心，每天都觉得自己的日子过的很糟糕。可真相往往是：生活本来就会有顺的时候，也会有卡的时候，那些片刻的不顺，被我们无限放大，负面情绪才会不断被蔓延扩散。 	 你一定也经历过这种无意识的「灾难化想象」：早上出门踩到一滩水，就觉得整天都不会顺；对方消息迟迟不回，就开始怀疑关系出了问题。 	 我们习惯把一个「小事件」扩展成「大结论」，明明只是生活的正常起伏，却被脑补成一连串坏预兆。 	 如果你愿意，现在就可以暂停这种恶性循环。当情绪上来的时候，不需要立刻变好，也无需强撑着积极。接纳它，把坏情绪放回原本的位置――一个短暂的、不完美的小片段而已。 	 喝口水、换个环境、做一件能让呼吸变慢的小事。你会发现：情绪没有那么大，生活也没那么重。那 15 分钟之外，还有23小时45分钟的空间等着你重新选择。 	 @心理薯@深圳卫健委","生活里的心理学, 懂点儿心理学, 灾难化思维, 人生不会完蛋的, 疗愈自己, 情绪管理, 情绪疗愈, 负面情绪, 不要自我怀疑, 抑郁焦虑",6天前,广东,1.2万,5885,185
https://www.xiaohongshu.com/search_result/693004f3000000001e037a53?xsec_token=AB82WdBfoUpp6Ljwp5gRq9CLV79j4Ku98FRmT8CvDguwI=&xsec_source=,大学城自习咖啡厅测评｜鹅带你走进期末月！,期末月即将到来！鹅鹅为大家整理了大学城及周边超实用的咖啡厅自习清单！按距离由近及远分类，附详细地址+核心优势，再也不用为找地方学习发愁啦～ ??大学城核心区（零距离！步行可达） 1??坊间咖啡 就在北岗小吃街！日咖夜酒形式，七点后会变成小酒馆，不过仍然保留自习空间哦，店内还有??猫猫～ 2??CEC(青蓝街店) 空间超大还到处都是插座，学习氛围浓到让人不自觉专注?? 3??星巴克(高高新天地店) 作为有【最多广州大学生自习】的星巴克，它设立专属“星子自习室”，不消费也能安心学，还有免费WiFi+充足插座?? ??近邻区域（约2公里，短通勤直达） 1??D&A CAFE 环境超安静，玻璃窗外就是大片草坪，学累了眺望草坪，眼睛和心情都能放松，治愈感拉满！ 2??C22 artisan coffee(生物岛店) 二楼全景玻璃窗座位视野超绝^o^工作日人很少，安静到能听见翻书声，适合需要背书的宝宝～ ??不过偶尔会有生咖包店活动，可提前了解，避免跑空～ ??稍远区域（8.5公里，地铁直达） 1??华农蜜芽・茶室(长隆时代芳华里店) 包间私密性超强，隔音效果满分！深度沉浸学习、赶论文、备战考试的宝子选这里，完全不会被打扰～ 2??Tims天好咖啡(时代CR8店) 店内环境温馨治愈，除了自习，西式简餐和贝果也超好吃，学习+干饭一站式搞定，幸福感爆棚～ 快码住这份清单，约上学习搭子一起打卡吧！鹅鹅祝大家祝大家逢考必过～如果有其他咖啡厅??推荐，欢迎在底下给本鹅留言哦！,"广州大学城, 自习室推荐, 广州自习好去处, 学习打卡, 期末自习室, 咖啡自习室, 广外, 广东外语外贸大学",5天前,广东,50,48,2
https://www.xiaohongshu.com/search_result/68571067000000000d027079?xsec_token=ABybz807vW8TbLBECvRo8026tKUJrxEHWs63g-1UJ7rtQ=&xsec_source=,无标题,大四好想去星巴克兼职。。。 本来超级超级焦虑，国贸找不到专业对口的实习，本来特别想去银行的，但是icbc实习网申都不要我自信心爆减，，，六级也还没过，学校推的实习也不是很想去，总之就是非常非常非常焦虑的状态，不知道自己的未来在哪里，就业规划也不坚定 但是感觉好像也没必要这么焦虑，没什么好焦虑的，就算找不到工作，去洗盘子我也能把盘子洗的亮晶晶的！而且我特别喜欢咖啡啊啊啊，想系统的学习！总之睡不着想通了很多！已经在boss上投递了，希望能有后续吧！没什么好焦虑的！！！ “天亮不亮是天的事情 人应当有自己心中的早晨”,,6月22日,,24,1,60
https://www.xiaohongshu.com/search_result/692d597c000000001e00c3f1?xsec_token=ABcjxr1T5thkv-cIrRZE_JUWODF-1T5wDR84J-zkqA7VI=&xsec_source=,??????,南沙星子有隐藏款 粉粉的星冰乐 和歌词贴 广州,"五月天, 五月天广州, 星巴克, 南沙, 这才是联名的正确打开方式",编辑于 7天前,广东,2,收藏,6
https://www.xiaohongshu.com/search_result/6932e847000000001e01559d?xsec_token=ABwzhfIBgjLj6B9D4u41r8kQDaWXprBLI2PgaUIkM2bSc=&xsec_source=,星巴克打工人的无奈,我先来，遇到白嫖党。 外卖送出去一个多小时后申请退单，聪明的不行的客服还不需要打电话跟门店确认直接秒退。 重点是，退掉的订单里有糕点，让骑手去取回，骑手被客人骂一通后，顾客直接说丢垃圾桶了。 我请问，你的肚子是垃圾桶吗？,"很担心打工人的精神状态, 上班的精神损耗, 上班人没有不疯的, 上班人没有不疯的, 打工人精神状态, 社畜的精神状态, 当代牛马青年, 咖啡师日常, 上班人精神状态, 当代职场人",2天前,浙江,8,1,17
https://www.xiaohongshu.com/search_result/693139da000000001e0034c9?xsec_token=AB19gKGefnSjsVn1FXM-L7fiKyW3UkGSYNX1-u-zVSEpU=&xsec_source=,好可爱,谢谢店员画的可爱表情，看到心情都超级超级好,星巴克,4天前,江苏,1,收藏,0
https://www.xiaohongshu.com/search_result/690ae526000000000301d2f3?xsec_token=ABvXzBaOz4JaPSapZ_t_gUJyxFkmn_z0wjSb-5HSYIwXA=&xsec_source=,星巴克亚运城喜街店招聘学生兼职,门店地址：广州番禺亚运城 欢迎来到星巴克广州亚运城喜街宠物友好门店应聘 有意向的小伙伴可以私信找我投简历 姓名： 联系方式（微信/电话）： 早班6:30，晚班下22:00是否能接受： 广州番禺亚运城喜街店 通勤是否接受： 每周供班天数/寒暑假能否供班： 毕业时间： 自我评价：,"我们需要你, 咖啡换故事",11月5日,,45,20,37
https://www.xiaohongshu.com/search_result/69354c88000000000d03c403?xsec_token=ABfO4xEEFRIOyxKH1LZyYlnpdTWzDPzUdDlJIjT-VCcsA=&xsec_source=,就在广州！！??发现哈利波特痛城！！明天开始！！,报！！！明天正式开始！！！ 二楼还在布置～ 哈利波特圣诞打卡地有啦！！ ??广州沙面星巴克 痛城打卡打卡地,"周末去哪儿, 哈利波特, 哈利波特痛城, 哈利波特打卡, 哈利波特打卡地, 广州探店, 广州拍照, 广州打卡, 巫师集结, 哈迷",昨天 17:44,广东,85,37,12
https://www.xiaohongshu.com/search_result/6853b6a7000000002400a301?xsec_token=ABSM1Wh9OdLR9mq6HuLqlDfvAHxmGGRlLsUA3ZlKdu_LM=&xsec_source=,在星巴克什么都能听到..,随便找个位置坐下，旁边的人可能在谈几千万的项目，可能在谈上市融资，可能在谈大厂工作感受… 这样期末怎么还能复习得下去,,6月19日,,1564,163,340
https://www.xiaohongshu.com/search_result/6921dd6a000000001e025df1?xsec_token=AB2UtXAmew44zvRi1-qda1wa8jgeXlUYbc8XzZimFMn0o=&xsec_source=,为啥我拍的感觉和别人好像有点不一样！,啊啊啊网上最近很火的太妃榛果拿铁 为什么我拍的感觉很普通 是滤镜问题还是拍摄手法有问题 求指教！谢谢 这款我点的是热的 味道还是很不错的嘻嘻,"太妃榛果拿铁, 星巴克",11月22日,广东,243,53,203
https://www.xiaohongshu.com/search_result/68eb66b8000000000402b540?xsec_token=ABtul8lNhWbuG6aqPE9CDgCqKAGE-Z3sUIVpnnALxT8PE=&xsec_source=,在熟悉的陪玩店得不到应有的服务,去熟悉的陪玩店消费，越来越不舒服，很奇怪！！ 之前发现了一家情绪价值比较高的三角洲俱乐部，然后三天就在里面下单了2000左右 由于他们撤离率不高，大概10撤1，所以打了好几天才打完。 但是由于他们一开始情绪足，所以我也觉得没什么，甚至还多给了100费用请他们喝奶茶，后续也要了地址，请他们喝星巴克，奶茶花了200左右。（给一整个工作室都点了） 但是后面越熟，打的时候，他们就完全不管我。 ①没有给我开过一次卡，都是我自己开卡，甚至打航天西大，过二元没卡也是我来刷。 ②打游戏的时候两个护去哪里都和我说，我游戏体验感很差。 ③理包都是我自己理，他们不会理包。 ④经常忘记带大红包，进去一趴就是十几分钟，打最后一队。 ⑤打的单子都是卡保底，最后还剩300万带我去机密大坝打了一把完成的保底，才打了130，还剩170也不管说打完了… 好不容易把这2000块钱左右花完了，我寻思接下来我不想找他们打了，因为打得慢每天他们都催我，感觉我在上班。（撤离率太低，10把撤1） 得不到应有的服务，因为感觉熟悉了。 是我的问题吗。还是他们的我真的。 后续找别的俱乐部不会这样了吧，不要一直在同一家俱乐部消费。,"三角洲行动, 三角洲, 俱乐部, 陪玩",10月12日,,84,5,112
https://www.xiaohongshu.com/search_result/6935ab73000000001e03100f?xsec_token=ABfO4xEEFRIOyxKH1LZyYlnvBsR_bmdJuPhqlUfvVdHvc=&xsec_source=,广州沙面星巴克哈利波特主题店！,提前一天活动！12月8日开启！ 冲冲冲！魔法咖啡,"哈利波特, 星巴克, 广州, 沙面, 星巴克魔法咖啡",编辑于 1小时前,广东,137,38,19
https://www.xiaohongshu.com/search_result/681ef9b80000000022024ca6?xsec_token=ABF2GXeDiWH443Jn6WkHjl_-AlJ5zcxwoGj0lY-eCAjCI=&xsec_source=,感谢华东政法大学,"本人热爱绿茶，每天一杯。平时不敢碰咖啡，本来知识分子就容易神经衰弱，喝了咖啡晚上更睡不着 	 所以，今天这杯拿铁，是很多年来我的第一杯。实在太困鸟其他老师选美式，我觉得拿铁已经够劲","法学院, 民法典, 要做努力的大学生, 世界能不能对我好一点, 研究生生活, 律师, 法律, 华东政法大学, 硕士答辩, 研究生答辩, 拿铁, 牛马, 打螺丝, 研究生日常, 即将毕业的压力, 我爱全世界, 只要导师选的好, 故余虽愚卒获有所闻, 大学生有使不完的牛劲, 生活大学在读, 告诉全世界",5月10日,,113,1,14
https://www.xiaohongshu.com/search_result/67b4ae34000000002602dc82?xsec_token=ABU5899o0CII9Cuhl14t8gbUXT7DhhO6vKY6tGx2H4T9I=&xsec_source=,星巴克2.18上市笔记本到手・情绪价值拉满,"一、前言（碎碎念・获取心路历程）：感恩搭子帮忙解决咖啡，2.18上市，店内两款本子各到货2个，中午打电话只有一样剩余一个，拍照留念（竟然没有摸一下手感），只是记得公众号帖子，熊本子带笔，实物没有笔，美人鱼本子还是非常端庄大气，下单的空只剩下美人鱼，而我就是想要美人鱼，是皮革手感，不是硬质塑料，专星送到咖啡店内直接取走。 	 二、玫瑰20咖啡 咖啡不另加糖不太甜，不能选不另外加糖微微偏甜。 	 三、笔记本状况 1、封皮：PU 2、内页：纸，年历、月计划、横线页。 	 笔记本周边","星巴克, 笔记本, 星巴克笔记本, 星巴克周边, 一杯20朵玫瑰",编辑于 02-22,,5,收藏,0
https://www.xiaohongshu.com/search_result/6913e8c10000000004011b1f?xsec_token=ABeeWWWgocOi8b6K1yHS68yFU0ysg1SdOaSOe_09PmXIE=&xsec_source=,啊啊啊好想辞职,星巴克学兼 两个多月了 收铺还出问题 不知道怎么了 最近打烊老出问题 每次打烊第二天都被艾特 昨晚收的时候一直想着 不要出错 结果今天还是忘记mo一个东西啊啊啊 之前打烊都不会 好烦 学生兼职,"星巴克, 星巴克学生兼职",11月12日,福建,11,收藏,18
https://www.xiaohongshu.com/search_result/6933b905000000000d03b88e?xsec_token=ABN7f33rruZgsOB3tgOibB9NjUlI8PZXNtPl353nmVnEU=&xsec_source=,高德置地秋广场随机物料投喂??,捉天河wmls 来打卡下单“卜卜combo”?? 获得织女老师的性感套装哦????? 还有限定贴纸派发,"mayday, 五月天, 广州五月天, 高德置地秋广场, 星巴克, starbucks, 拉花, 卜卜头套钩织",2天前,广东,7,2,6
https://www.xiaohongshu.com/search_result/68b2577a000000001d023101?xsec_token=ABHYcADonNdle76KvZfdjjY1JiK_9iVHsNpDpTaEsiyS4=&xsec_source=,厦大自习去处,开学第一天，来访客中心的星巴克小学一下，离得近，也方便，什么都有。但就是比较吵，可能运气好，坐到里面的位置，有插座也比较私密，估计下午人就多了，音乐声音太大 适合学习程度????,,8月30日,,29,6,5
