帖子链接,标题,正文,标签,发布时间,发布地点,点赞数,收藏数,评论数
https://www.xiaohongshu.com/search_result/68bbd3df000000001c03f376?xsec_token=ABn5AzjaCMX-RLEo0sFkBXj0MZGVq_MvaOHXuyClJ3tTc=&xsec_source=,来星巴克上咖啡课堂啦~,周末来星巴克参加咖啡课堂，学习到了关于咖啡产区的知识，还动手制作了法式压滤壶咖啡，十分有趣,星巴克,9月6日,,4,1,2
https://www.xiaohongshu.com/search_result/69149a49000000000702341c?xsec_token=ABctSISROuYg8GjulqEVTx1jq67wDRuqaZiUKsKv1sSIc=&xsec_source=,星巴克的咖啡夜校去上了 附攻略,"由星巴克与深圳市青少年活动中心共同举办“咖啡赋能-青年夜校”活动, 共4次课，限额30人/店四家门店同步开展）。","夜校, 咖啡培训, 星巴克, 年轻人抢着上夜校",编辑于 11-16,广东,26,5,6
https://www.xiaohongshu.com/search_result/61208c70000000002103974c?xsec_token=ABHzTGKFo1CEFDl6xO5D2R81DNZMY6I285jwrPJf4zAbs=&xsec_source=,星巴克第二杯免费！星冰乐买一赠一的快乐！,星巴克买一赠一的活动又又又来了 依旧是第二杯免费！ 步骤见图2和图3，每一步都给你们标出来啦！ 不明白的可以再问我 这次活动只有摩卡可可碎片星冰乐哦 别的饮品有十几款参与第二杯半价 在我两三天前的那篇 需要的可以看一下 ― ― 快艾特你的好姐妹一起冲！ 每人十几块就可以喝星冰乐！！ - 买一赠一买一送一薅羊毛,"星巴克活动, 星巴克, 星巴克买一赠一, 星巴克买一送一, 星冰乐, 摩卡可可碎片星冰乐, 星巴克薅羊毛",2021/8/21,,1849,767,267
https://www.xiaohongshu.com/search_result/61066263000000002103b92e?xsec_token=ABcgthH4pwKp-DQ5GosPds_hor97IcOgIn-7HvX3GiQgY=&xsec_source=,9??元星冰乐|星巴克的羊毛我薅到了??,"?星巴ke这么好薅的羊毛，我不允许你不知道?? 	 ?打开支付bao，搜索学生价，里面有好多星冰乐减1??0??元的优惠券！（参考图三） 	 ?继续在支付bao，搜索点餐优惠，领取优惠券，最高的减5??元！（参考图四） 	 ?还是支付bao的，用会员积分兑换，666积分8??元/599积分6??元优惠券。（积分不够的点我的积分去完成任务就有了） 	 ??Tips:前面在小程序点的时候没有立刻显示优惠不要紧张，要到支付的最后一个界面全部优惠才会显示的。 	 星巴克|星冰乐|星巴克薅羊毛 优惠券|星冰乐优惠券 优惠券","星巴克, 星巴克优惠券, 薅羊毛",2021/8/1,,1744,806,126
https://www.xiaohongshu.com/search_result/6030ab6e0000000001029ad8?xsec_token=ABYSZWiIl_L7GmnCn-j-bxtduEnyeJs6kaPuVJFiRRAnY=&xsec_source=,教你怎么免费周末喝星巴克的方法！,重点，目前这个活动到2021年4月14日结束！ 今年活动预计还会延续，但是估计积分会扣更多。 1.必要条件！有中国银行信用卡，账户有22000积分！ 2.去星巴克必须带上实体信用卡，是用信用卡刷积分兑换的！ 3.周一到周五是22000分兑换一杯！重点周六周日，22000积分兑一送一，就是说22000积分换两杯大杯星巴克饮料！我都是周六周日用的 4.重点，一定要和店员说中国银行22000积分周末兑换活动，买一送一！有些店员不熟悉的，一定要找懂的店员操作！ 图2图3是活动介绍，图4是现场兑换的收据，图5是扣除的积分。 6.加3元可以升超大杯，各位客官自行选择。我一般不升，够喝了 星巴克免费喝香不香,,编辑于 2021-03-03,,3,3,0
https://www.xiaohongshu.com/search_result/6108b6cb000000002103d976?xsec_token=ABdN6E5s_3glQAZK8gLgEiruysMTKE1N8pgHi77VAk8yc=&xsec_source=,48r??三杯星巴克｜一起来薅羊毛啦！附攻略??,怎么能允许自己不薅羊毛呢？！ 作为 的资深老玩家 这两年在国内待的也是研究出了他的各种优惠机制 尤其上班之后 咖啡简直是通勤必备 我又贼喜欢积分积星星 那星爸爸就是不二之选啦～ ??首先你要拥有一个星巴克app 里面有啡快和专星送 贼方便 ??每次买之前记得先看一下app主页上的活动 例如： 啡快常有的云闪付???70-20/???60-15（每天的活动要求不一样 招行/建行不一定） 专星送常有的???80免外送费/???20免外送费/拼单满减等等 还经常有类似于你买一送一的活动/第二杯半价/第三杯免费/免费升杯这样的神仙活动 ??xcx里也经常会发优惠券 ??线下在门店的时候 可以看一下收银台上面的银行活动 就比如我周一买就是wx关联工行借记卡/信用卡支付???60-15 可以和店内的其他活动同享 因为门店活动和银行给的活动是分开的 不冲突～ 也记得看看海报上有没有什么门店的专属活动哈～比如有的时候云闪付的满减是只能门店支付才可以使用滴 ??集星星 集星星 多集星星！我已经换过n杯免费咖啡了哈哈哈也升杯过n次了 ??跟常去的星巴克门店的小哥哥小姐姐们搞好关系哈哈哈哈哈！！有好多优惠活动我没发现他们就会来提醒我??（这次饿了么摩卡咖啡打折就是门店小哥告诉我的哈哈哈 我赶紧抢到了！） 最近下午3点后 大杯的茶云系列产品以及冷萃咖啡都有买一送一哦～门店和啡快都??? 你们看看当天哪个满减会比较合适就用哪个！！ 我48??get到了三杯 让我看看还有没有更牛的姐妹子哈哈哈！ 下次教你们如何一分钱不花就get星巴克！！ （图一配图只是因为觉得我拍的很带感哈哈！突然想起昼川的那句话：我被光所诱惑??） @小红书创作学院@创作者小助手@薯队长@吃货薯@日常薯点单攻略省钱攻略买一送一薅羊毛福利,"金牛座, 星巴克, 星巴克点单攻略, 薅羊毛, 星巴克省钱攻略, 星巴克买一送一, 星巴克薅羊毛, 星巴克福利, 省钱攻略",2021/8/3,,112,29,1
https://www.xiaohongshu.com/search_result/60f1e8a6000000002103cd12?xsec_token=ABqx1KhFj0T5h_zLx8KHuGua_QNgVH_vRuT9Tbd_5hDSA=&xsec_source=,星巴克攒星星新手指南｜薅羊毛大法总结,天天宅在家工作之后，其实反而没那么频繁地喝  Starbucks[品牌]。星巴克当然不能失去自己的忠实客户群体，各种奖励星星的活动接二连三，还是让人无法抵挡诱惑呀?? . 昨天收到活动邮件，7.16-7.18期间，点一杯任何形式的拿铁，就可以有15颗星星的额外奖励。今天和队友出门买完菜就顺便点了杯冰拿铁，大夏天的真是舒爽！大家可以看看自己的邮箱/APP有没有这个offer哦。 . 星巴克APP羊毛总结?? . 1??下载星巴克的APP，可以免费注册一个会员帐户。 . 2??往APP里提前充值的话，每消费$1可以获得两颗星星，如果现场用信用卡/PayPal付款的话，每消费$1有一颗星星。 . 3??定期有bonus星星的任务挑战，一般会先收到邮件，晚一点该挑战也会在App里的“offer”区出现。 . 4??所有的活动挑战都是personalized，也就是说每个人收到的活动内容/奖励可能不完全一样。但大多数活动发布的时间是差不多的，看到别人发布相关内容之后可以去自己的邮箱/App里看看自己是否收到了类似/一样的offer。 . 5??有的活动对于消费要求比较高，比如连续4天消费、一次消费超过$20等，还是要理性消费，不要为了一些bonus而浪费钱。充值类的比较合算，比如前几天我收到一个offer是用PayPal充值$20就可以送100颗星星。 . 6??积攒一定的星星就可以去店里换饮品/点心/杯子等东西了。150颗星星就可以免费换一杯饮料，没有杯型限制。 . 7??注册会员后生日当天可以去店里领取一份免费的食物/饮品，具体的offer会在生日前发邮件&在app里进行通知（需要至少在生日前30天注册Starbucks Rewards的账号）。 . 北美生活｜美国留学｜美国星巴克｜星星奖励｜薅羊毛｜北美羊毛｜星巴克｜咖啡｜新手指南,"星巴克, 了",2021/7/17,,15,7,0
https://www.xiaohongshu.com/search_result/60c0a634000000002103a3ea?xsec_token=AB3mXj9ggQW76xsES1FhNTVP4bqH5rPnTBmU9gJNcGYPU=&xsec_source=,星巴克买一送一领券还能优惠6元,"1??首先你要准备一张DIY的“准考证” 只要带有（准考证）这三个字的任何都可以！ 2??提前在你的微信支付里面点击更多??支付有优惠??兑换好礼??然后在里面找到星巴克买30-6的券??领券 3??现场点单 记住使用券的话一定要用微信支付哦 不要用支付宝 否则是用不了 ??：活动6.8～6.13号 记住是下午3点后买 才有买一送一活动 ?? 指定买一送一饮品种类： ??比利时黑巧慕斯星冰乐 ??芒柚甘露星冰乐 麦芽雪冷萃..等等等 	 ??超大杯用了券之后是38?? 	 有一说一 新品芒柚甘露星冰乐里面的柚粒有点酸苦 里面有一个鱼??型的白巧克力 也意味着考生“鱼跃龙门”8?? 这波星爸爸好评！！！ 	 ??更新：小程序下单 不需要准考证 也可以买一送一！ 	 撸羊毛｜省钱小妙招｜星巴克 @生活薯@吃货薯",,编辑于 2021-06-09,,3413,1262,181
https://www.xiaohongshu.com/search_result/64b0b45f0000000034016894?xsec_token=ABDlTrpzhk7Y27NCTJTokV-V3mEyIB8TuqcbCg4ao9zBw=&xsec_source=,香港星巴克 免费一杯咖啡Get,"香港星爸爸在IG的活动。 注意要主动跟他说个hi，然后就会发登记链接给你。不要只是留言然后等着他来抽奖！根本等不到！一定要主动！ 	 收到链接后登记会员资料后就能领取，没有会员要注册会员。新会员还送一张买一送一的券。 免费咖啡券五个工作日才会发到APP中。相当于一定要下载APP。另外还需要香港的手机号码。","香港生活, 香港星巴克, 香港咖啡, 免费喝咖啡",2023/7/14,,66,43,73
https://www.xiaohongshu.com/search_result/5cd5152a000000000f017ded?xsec_token=ABbxj-TGDyGlZgIcSIgDxfVBek1TYMjlWpqqFHsdu-Auo=&xsec_source=,无标题,星巴克买一送一又回来啦！还有这份2019星巴克信用卡积分兑换攻略！?? 今天的双倍快乐来自周五和星巴克哈哈哈！???? ??『周五广发分享日星巴克买一送一』?? 5月10日―6月28日（每周五专享）星巴克指定手工调制饮品买一送一（冰淇淋产品除外）每卡每活动日限享1次优惠，名额不限！ ??这次和之前的活动有点不一样！ 这次不用带实体卡，但是只能通过发现精彩APP的二维付款并选择广发信用卡付款的。才能享受买一送一活动！ ??『2019星巴克信用卡积分兑换攻略』?? 1??中国银行积分兑换 平日15000分可兑换一杯（大杯）而且不限量，有多少积分都可以换，周末15000积分兑一送一，每人每周限一次加持5倍积分权益，相当于消费3000块就可以兑换两杯了 2??招商银行积分兑换 799积分兑换一杯（中杯），招行积分不好攒，不建议这么奢侈，如果是大老板，就随意换吧~ 3??浦发银行积分兑换 28000积分兑换一杯中杯，意思是消费5600元所获积分可以兑换一杯 4??中信银行权益兑换 消费达标后每天10点使用9积分权益在线上兑换一杯，刚性年费白金卡可以选择线上，兑换或每月19号去店内刷卡兑换（大杯） 5??交通银行积分兑换 21000积分的兑换一杯（中杯） 6??邮政储蓄银行积分兑换 白金卡每月消费1888元次月享88积分，兑换星巴克中杯券，金卡每月消费888元，次月享888积分兑换中杯券，每人每月两种各限参加一次（需要报名） 7??华夏银行达标领2杯 每月计积分288元*3笔获得1次权益，288元*6笔获得2次权益，每天10点兑换，每天3500张，大家都可以参加，所以兑换难度比之前0点兑换可能会稍微大一点，最近常常秒无。 8??中国银行60-20 每周二、四使用中行APP或缤纷生活APP或云闪付APP二维码单笔满60立减20 9??交通银行55返20 每周五使用支付宝、微信、银联二维码、各种pay支付单笔，满55返20元刷卡金，7天内用来抵扣日常消费 信用卡的积分可以用来兑换星巴克哦 积分千万不要浪费了！冲鸭！！！！,,编辑于 2019-05-10,,403,548,108
https://www.xiaohongshu.com/search_result/691ea81c000000001d03ed79?xsec_token=ABow1JjUgWqmIiaVTift_LCZHCbeIcxZ68eCyP_vSG0eI=&xsec_source=,瑞幸重生：从挑战星巴克，变成挑战蜜雪冰城,"@晚点小数据 	 几周前，星巴克中国宣布出售大部分股权，交易时的整个业务估值 40 亿美元（扣除现金和债务）。与此同时，瑞幸市值超过 100 亿美元。如果比单店估值，两者也只差一成多，尽管星巴克门店普遍更大、装修更好、位置也醒目。 	 2020 年因财务造假从纳斯达克退市时，瑞幸有 5091 间店，比星巴克稍多，但营收只有星巴克 1/4，并且每卖一杯亏 5.6 元。五年后，瑞幸的店数是星巴克的 3.6 倍，整体营收则是 2.6 倍，每一杯都有 1.2 元利润。 	 这是星巴克自己的失误，也是瑞幸在管理层换血后，尊重产品尊重效率的转型胜利。星巴克交易几天后，瑞幸 CEO 郭谨一在厦门市的一场活动上发言，说正积极推动重回美国主板上市进程。虽然之后的营收会上，他表示还没有具体时间表。 	 但当瑞幸成为中国咖啡品类第一，它面对的竞争环境比五年前挑战星巴克时更激烈了，因为对手从一个外企变成了几个创始人带领的万店本土茶饮品牌。 “咖啡市场和奶茶市场不是绝对分割的，而是互相交融的。”本周，瑞幸董事长、最大股东大钲资本的创始人黎辉在接受采访时说，“现制饮品市场其实是个统一的市场，咖啡和奶茶的消费者可能是同一拨消费者。” 	 瑞幸卖得最多的咖啡从来不是美式，最大的爆款是咖啡基底的生椰拿铁，更像奶茶一样的休闲饮品，而不是更具功能的黑咖啡。 	 过去一年多，竞争变得更直接。瑞幸去年做了轻乳茶，今年重推生椰杨枝甘露。它有效阻击了产品单一的霸王茶姬，但没法轻松打发规模庞大、长期投资仓储物流、供应链的蜜雪、古茗。 	 蜜雪冰城在 5 万多间门店推广 5-7 元的雪王咖啡，其他品牌硬着头皮做 9.9 元产品是价格战，对它则是消费升级。蜜雪的兄弟品牌幸运咖出师不利，但毕竟生在罗马，今年再次调整产品、加速扩店，直指瑞幸更密集的一二线城市，要在年底开到 1 万家。古茗将咖啡作为门店加盟商增收的手段，安装瑞幸同款自动咖啡机、以冷链配送鲜奶，去抢咖啡店的生意。 	 星巴克曾经想在中国保持轻奢定位，给瑞幸留下了机会。瑞幸诞生之初，给咖啡定了接近星巴克的价格，虽然长期打折到 15 元以内，但总有价格回升的可能。 	 五年之后，经过各品牌自发的 9.9 大战、外卖大战、消费下行，一杯咖啡或奶茶卖 15 元已经可能被人说“贵”。一个大连锁要在中国胜出，要达到新的规模和效率。","晚点latepost, 商业, 奶茶, 咖啡, 瑞幸, 星巴克, 蜜雪冰城, 生椰拿铁",11月20日,北京,77,41,4
https://www.xiaohongshu.com/search_result/69149037000000000700c563?xsec_token=ABctSISROuYg8GjulqEVTx1lmdwRgwuEPtZSXQJ2aeC0o=&xsec_source=,无标题,星巴克把我恶心到了，太下头了，刚进来坐下，拿出手机的功夫，服务员竟然跑来说，不消费不能坐在星巴克里。等朋友来了，点单过程中，那个女服务员又跑过来问，点了吗？让人非常不舒服，好像被星巴克定义为白嫖客一样。如果一进来先坐下再点单，被店员轰，这样，以后也不会再进来了。感受太差。,,11月12日,天津,7,1,14
https://www.xiaohongshu.com/search_result/69365344000000001e00c401?xsec_token=ABkupRkjzD3a-DVEzheUHle1QLii4YMQkNoN40JtKWALY=&xsec_source=,跨年活动！！！??????,福州WMLS跨年狂欢・人生无限公司福州爆破分公司招聘活动启动啦！?? 本次跨年活动包含两大核心环节： ①人生无限公司福州爆破分公司沉浸式入职游戏 ②观影活动（人生无限公司大电影，若有直播现场切换） ↓活动须知↓ ??活动时间： 2025年12月31日18:00―2026年1月1日01:00 ??活动地点： 福州东百元洪城 ??入职游戏说明： 为观影前的沉浸式趣味探索活动，欢迎各位老师积极参与！游戏难度适中，入职成功即可免费领取【部门限定】入职大礼包，快来加入吧！ ??观影开票通知： 观影的开票信息将后续在爆破群/轧车群同步，无需重复加群，留意群消息即可。 1??【元洪城5F电影院】（收费：50元/人） 影院观影：恭喜获得星子后勤部提供的影厅观影资格！现场可选择星巴克饮品，尽享专属观影体验！（内含：门票+饮品） 2??【元洪城1F中庭】（免费） 大屏观影：留在场外的老师可汇聚至中庭，与远道而来的伙伴们一同倒数跨年，共庆新年！ ??影院与中庭观影内容完全一致，仅有氛围与道具上的区别！,"wmls练团, 去温暖的地方跨年, 五迷集合, 五迷",昨天 12:25,福建,点赞,收藏,0
https://www.xiaohongshu.com/search_result/69339edc000000001e031c1a?xsec_token=ABhbXbJCcPqc_ww2pvMr-sgTd5abejeqaGZReVoIv7Qnc=&xsec_source=,大学生集合，周末外卖半折来了，是谁又幸福了,"谁懂啊，刚月初就已经花了五百块钱了，一发生活费就买了衣服裤子，导致生活费1500的我就剩下三分之二了，这部分还要撑下三个星期有点痛苦，毕竟我还亏待不了我的嘴 	 但是就在今天我亲爱的室友兼饭搭子告诉了我一个好消息，就是我宠爱的团子又有新活动啦，就是在周末的时候可以??咱们这个半折歪卖??哈 	 但是这个有个前提得是咱们这个黑??或黑??会员，作为天天吃歪卖的我能没有这个这个黑??会员嘛当然是有的，平时只喝瑞兴的我，直接和室友喝起来高档的星巴克 	 不说了，我要和室友一起在看看有什么好吃的大餐点来在宿舍一起看着电视??一起吃着美味的大餐??，我滴妈好幸福啊，这份幸福还要感谢??团子呐红包","外卖, 会员真划算, 省钱攻略, 外卖红包, 跟着大学生吃就对了, 机智的吃喝省钱生活",2天前,江西,32,1,15
https://www.xiaohongshu.com/search_result/692c7eb4000000001e034487?xsec_token=ABzy0zs87CXqpua6UDjrb6QLoB6Wfzl1fFJs59g1_I7Xc=&xsec_source=,12.1周一外卖奶茶活动汇总,"详细活动看图，持续关注?? 	 今天幸运咖答案：幸运。",,编辑于 7天前,陕西,9,4,0
https://www.xiaohongshu.com/search_result/68f5f6710000000004007b26?xsec_token=ABvW8u0z-vf7s42A01oo4cJ5V4Z1wtujkK-W0pFLphv74=&xsec_source=,大学生,,,10月20日,,346,254,0
https://www.xiaohongshu.com/search_result/684e5987000000000c03ba33?xsec_token=AB4gStIqOcxhjP_1-GeR8fhDCRESE-Ef0Ku3bIfRvM8yM=&xsec_source=,在香港如何买辛巴克,相信很多内地来香港的第一时间会打开星巴克APP，和内地星巴克小程序。结果发现根本不能用，无法点单。 教程来了： 1）打开微信搜索“星巴克香港及澳门”，用这个小程序就可以点单了； 2）关键还可以微信支付，对i人非常友好，如果你是e人，那也可以直接柜台点单。优先使用英语，如果英语不好那就用粤语，实在不行再用国语吧。因为在香港是有鄙视链的，你英语很流利，香港人会高看你，你用粤语，你会感觉香港人的亲切感。如果你用普通话，对不起，你可能会遭到冷漠对待。白眼不敢说，但是降品质的从上往下看人的眼神和语气你可以深刻感受到，什么叫冷冰冰的服务。,,6月15日,,162,84,36
https://www.xiaohongshu.com/search_result/686f2c26000000000b01ccaa?xsec_token=ABS_YmVxe3GxZZQWpA_M16IURSPL46Exa2Ta_JGr9UskQ=&xsec_source=,星巴克，你还是消费入座吧！求求了,一大早给人整无语了，国人素质还是太参差不齐了，给我一个大大的震惊，都2025了，怎么还有人这个样子？她不会觉得她很放松很舒适吧？不会把别人店当她家吧？？仔细看她竟然还是点的瑞幸来蹭坐咖啡@星巴克@瑞幸咖啡 你还是给你的顾客搞点座位吧,"星巴克, 星巴克咖啡, 瑞幸",7月10日,,13,收藏,18
https://www.xiaohongshu.com/search_result/692bd7be000000001f00445f?xsec_token=ABu046R58jaEb0rKCy3JgJVrc-OsXG-uDDHqjtUNju1co=&xsec_source=,无标题,福田星巴克在找兼职小伙伴,大学生兼职,11月30日,广东,2,收藏,9
https://www.xiaohongshu.com/search_result/67f49500000000000f03b8ac?xsec_token=ABG1qg5f97Q6crnVvZj8KjIkqHmjTLFEDysl8xAUmhDbM=&xsec_source=,??星巴克员工的一天,20205年DD也来啦.大家有需要可以找我员工,"星巴克, 星巴克员工, 星冰粽, vlog, 日常",4月8日,,2692,260,70
https://www.xiaohongshu.com/search_result/69268895000000001e015de9?xsec_token=AB_t0Hucsryqv2oyMB_7t2oDAdMBEDGfUbYVpihdIUFYo=&xsec_source=,县域星巴克观察日记,"今天下午下午4点来星巴克写论文。 进来以后，座位上都是避寒的老人。三三两两的老年人在星巴克聊天，有妇女桌也有老登桌。此处成了县城情报中心....咖啡小哥也听得津津乐道，谁家媳妇又堕胎了、又要给谁家的儿子介绍对象、谁家被老赖欠了60w。 晚饭前，县城星巴克又涌入两批老年人在此聊天。 	 为什么县城会有星巴克？为什么一整天也没什么年轻人、中产进来消费（当然和今天是工作日有些关系）？ 和deepseek讨论了一下，后面得出这样的结论： 1??对于我的困惑： 你作为年轻的城市人类学研究者，进入县城星巴克时感受到： 营销逻辑不符预期 空间使用者与品牌形象不一致 消费行为脱离“现代咖啡文化” 这种“错位感”本身是： 全球化文化与地方生活世界之间的张力 你看到的不是“奇怪的县城咖啡店”，而是： 现代性输送与地方社会秩序之间的断裂点。 	 星巴克的创始理念是： “第三空间”（家与办公场所之外的公共社交空间） 但在县城，消费型第三空间并没有真正形成。 于是就出现文化错位： 青年上班、在外地 中年人嫌贵、不理解 老年人反而最有时间、最敢来坐 	 2??后面我想起《金拱向东》，或许星巴克在都市中营造出来的现代性符号，在县城会被重新生产出新的意义。 星巴克在县城被重新本地化，成为： “县城老人的免费休闲空间” 从人类学角度，这是一种： 全球化企业提供的空间，被地方社会按照自己的文化逻辑重新使用。 	 3??或许....和王笛对成都茶馆的研究也有联系《茶馆：成都的公共生活和微观世界》 老人使用星巴克：反映县城公共空间的缺失 县城缺乏： 温暖的室内公共空间 免费坐的地方 老年社交场所 “星巴克变成老人取暖的地方” 其实是中国县城公共空间贫瘠的体现――如果老人活动中心、社区空间都足够，老人不需要来星巴克。 星巴克是市场化补位公共空间的典型案例。 老年人的“空间占领”：反映代际资源分布 县城的年轻人外流，中老年人留守，消费结构差异巨大。 青年不在县城工作 老年人才真正拥有“能坐着的时间” 	 于是县城星巴克出现了一个特别有意思的社会学结构： 年轻人创造的生活方式符号 → 老人实际使用了它的空间 这反映了中国典型的“代际反转”：社会资源与空间资源更多地被老年人占领 日常考研","人类学, 人类学日常, 空间, 咖啡, 星巴克, 社会学, 社会学考研",编辑于 11-26,安徽,394,65,121
