帖子链接,标题,正文,标签,发布时间,发布地点,点赞数,收藏数,评论数
https://www.xiaohongshu.com/explore/62f1f66c000000000900cdbe?xsec_token=ABZM7Um2DjUe404qSyCKk9JcCQiMBWE2ii_32C0Yfb0is=&xsec_source=pc_user,【 严 正 声 明 】??,,"瑞幸咖啡, 瑞幸",2022-08-09,未知,6034,79,742
https://www.xiaohongshu.com/explore/62f1c7f10000000009004658?xsec_token=ABZM7Um2DjUe404qSyCKk9Ja8DkqPsJ52muGz2nIElnOc=&xsec_source=pc_user,喜欢甜咸口咖啡的进??海盐系列官方测评??,4杯海盐系列纠结喝哪杯？真实口感测评来咯！ 每一杯都是不一样的好喝照着点不踩雷！ 和我一样喜欢甜咸口咖啡的宝！速速??起来！ 	 ??夏末海盐拿铁-冰-少少糖 有点咸，但不多，有点甜，但不腻 独特的海盐焦糖味，真的会爱 ??这一杯里是真实海盐，没有海盐芝士奶盖哦！ 	 ??海盐芝士厚乳拿铁-冰/热-半糖 这款不用多说吧？经典款不挑人?? 奶味+芝士味浓而不腻，能喝一辈子的好喝 	 ??海盐芝士茉莉鸳鸯-冰-标准糖 喜欢茶味重的宝冲这杯！我滴乖乖真的大大的清爽又清香！！！有奶盖更满足！ 	 ??海盐芝士鸳鸯拿铁-冰-标准糖 淡淡的茶味刚刚好，清爽又不失可盐可甜 ??是那种很低调的好喝！ 	 p.s.糖度可根据个人口味自行调整～ 	 新品种草夏末海盐拿铁,"瑞幸咖啡, 瑞幸, 瑞幸新品, 瑞幸种草, 瑞幸夏末海盐拿铁",2022-08-09,未知,2207,712,327
https://www.xiaohongshu.com/explore/62f091800000000016032a4b?xsec_token=AB0ubUVF-2rZXfLFm88rdVxJyDNemBhq4VJyqPQy3rxjg=&xsec_source=pc_user,瑞幸有迷你麻薯啦！一口一个Q弹软糯！,来了来了新品又来了！【来个麻薯】上新！ 可爱又好吃的小麻薯，这谁看了不迷糊 	 ??个头超mini，圆圆鼓鼓，糯叽叽有嚼劲！ ??肉眼可见贼多葡萄干，Q弹还酸甜～ ??一盒里12个，一口一个简直停不下来！ 	 编辑这条小红书的功夫没忍住炫了一盒，嘿嘿嘿嘿嘿满足家人们赶紧去尝尝！,"瑞幸新品, 瑞幸咖啡, 瑞幸种草, 瑞幸麻薯, 小麻薯, 瑞幸甜品",2022-08-08,未知,374,29,191
https://www.xiaohongshu.com/explore/62f0653d0000000012035122?xsec_token=AB0ubUVF-2rZXfLFm88rdVxKR3yT4R6fYMHqZKD-vLU3E=&xsec_source=pc_user,瑞幸新品??夏末海盐拿铁！微微咸！吼吼喝！,周一忙里偷点“咸”来杯新品【夏末海盐拿铁】 已经替大家尝过了！可盐可甜好喝没毛病！ 	 ??添加真实海盐，融合丝绒厚奶+浓缩咖啡 ??喝起来甜咸交织，微微咸，不甜腻 ??香浓顺滑的同时，甜咸口感拿捏得恰到好处！ ?建议【少少糖】有种夏末海风的味道???? 都去冲它！你会爱的夏末海盐拿铁,"瑞幸咖啡, 瑞幸新品, 瑞幸种草, 瑞幸, 瑞幸夏末海盐拿铁",2022-08-08,未知,510,109,600
https://www.xiaohongshu.com/explore/62ef2799000000001b021a26?xsec_token=AB2WxQ9QtQW45tbKbcxMVGrFWcb4fopRA0tHeMdg3tYTQ=&xsec_source=pc_user,求安利好喝的瑞幸！替网友诚心发问,这题就交给你们来回答了！ 哪款是各位最近反复回购的独宠？ 家人们互相交流一下！来挖宝！,"瑞幸咖啡, 瑞幸",2022-08-07,未知,5388,2892,15000
https://www.xiaohongshu.com/explore/62eb7ba1000000001203827e?xsec_token=AB0BLDjdQpCR_lgGD3VPrQW9wjlHtBhnCgQp-2fLE4DPo=&xsec_source=pc_user,如何在七夕正确饮用瑞幸咖啡？,七夕限定,"瑞幸咖啡, 瑞幸, 瑞幸七夕限定, 七夕, 孤寡",2022-08-04,未知,254,33,52
https://www.xiaohongshu.com/explore/62eb646e000000001b01a7cb?xsec_token=AB0BLDjdQpCR_lgGD3VPrQW_00kjQuTdKs4GXfp4gc9mw=&xsec_source=pc_user,七夕限定壁纸??艾特你的对象&朋友一起用,一套喜庆的壁纸送给大家！ 七夕不咕呱！牡丹也快乐 原图送上～欢迎自取 	 七夕限定悲伤蛙联名,"瑞幸咖啡, 瑞幸, 瑞幸七夕限定, 瑞幸悲伤蛙联名",2022-08-04,未知,480,105,141
https://www.xiaohongshu.com/explore/62eb494e000000001b0229d8?xsec_token=AB0BLDjdQpCR_lgGD3VPrQW0aWntJ6-IK1CmqM6lUw6To=&xsec_source=pc_user,3个七夕送礼小技巧！保证ta满意??,不知七夕送点啥？就送瑞幸礼品卡?? 4款卡面任你选，不论情侣or单身?? 总有一款ta喜欢！实用甜蜜又浪漫?? 礼品卡指路在最后一张图 今天就给ta一个大大大惊喜吧 	 七夕限定悲伤蛙联名·送礼攻略,"瑞幸咖啡, 瑞幸, 瑞幸七夕限定, 瑞幸悲伤蛙联名, 七夕攻略, 七夕礼物",2022-08-04,未知,277,41,76
https://www.xiaohongshu.com/explore/62eb2e830000000016034331?xsec_token=AB0BLDjdQpCR_lgGD3VPrQWwLHqpSmk4CM1NF_GWx3r24=&xsec_source=pc_user,请转发给身边需要的朋友,悲伤蛙联名孤寡青蛙,"瑞幸咖啡, 瑞幸, 瑞幸悲伤蛙联名, 七夕, 七夕孤寡青蛙",2022-08-04,未知,298,38,123
https://www.xiaohongshu.com/explore/62ea1e060000000012006383?xsec_token=ABeHAlqphLXl394PujiWdyIdvKWYlOPr33cbYldvnM_wA=&xsec_source=pc_user,没有一个纸袋逃得出瑞幸??DIY纸巾包&书签,你们整活小瑞又又又来了！超实用教程送给大家： 纸袋变身抽纸盒，杯套变身书签?? 有手就会巨巨巨简单?? 详细步骤见图～ 包你分分钟get同款！ 	 七夕限定悲伤蛙联名纸袋,"瑞幸咖啡, 瑞幸新品, 瑞幸, 瑞幸七夕限定, 瑞幸悲伤蛙联名, 瑞幸咖啡纸袋, 手工DIY, 舍不得扔的购物袋",2022-08-03,未知,7529,3621,670
https://www.xiaohongshu.com/explore/62e9f7e2000000002302b7ed?xsec_token=AB2_bykWrhMSriJO2EhCHz3JqmXfE9xGmPK2Afp5hVjhE=&xsec_source=pc_user,打工鹿的幸福就拜托各位了??,为打工鹿全网寻一知心爱人！ 欢迎各位姨姨叔叔哥哥姐姐们来做媒 （接受自荐） 	 七夕限定悲伤蛙联名,"瑞幸咖啡, 瑞幸, 瑞幸七夕限定, 瑞幸悲伤蛙联名",2022-08-03,未知,370,38,285
https://www.xiaohongshu.com/explore/62e9e30d00000000110131a6?xsec_token=AB2_bykWrhMSriJO2EhCHz3Mp1VQZ__pM5O6JC3W37ckQ=&xsec_source=pc_user,瑞幸出七夕限定手机壳了！？居然有3款,快@你的对象&单身贵族朋友一起用七夕限定悲伤蛙联名纸袋,"瑞幸咖啡, 瑞幸, 瑞幸七夕限定, 瑞幸悲伤蛙联名, 瑞幸咖啡纸袋, 手工DIY, 手机壳",2022-08-03,未知,470,105,68
https://www.xiaohongshu.com/explore/62e8c9160000000012028ab8?xsec_token=ABqJcaZV5c3WpqkVtFxLDKAjkv2F164RAFVwglTRllm2I=&xsec_source=pc_user,七夕限定勋章谁还没有？（附点单指南秘?,七夕限定勋章友友们都get了吗？ 解锁方式送上： ??即日起-8月7日 ?任意完成两单即可获得【哇瑞喜欢你】限定电子勋章啦 	 顺便附上一份七夕点单指南！随便挑！都好喝！ 【官方七夕CP】 ??哇瑞草莓拿铁：真实草莓果汁，甜而不腻 ??百利甜莓拿铁：添加百利甜酒，清甜微醺 	 【恋爱三部曲】 ??初恋青提拿铁 ??抓马西瓜拿铁 ??偷心西梅拿铁 	 【七夕心动套餐】低至5.5折?? ??哇瑞喜欢你套餐：2杯七夕限定 ??七夕不咕呱套餐：杨梅瑞纳冰+抹茶瑞纳冰！ ??一点甜套餐：2杯七夕限定+1份甜品～ ??摩摩哒套餐：生椰爱摩卡+摩卡 	 咖啡，冰沙，甜品…总有你爱的味道！ 七夕限定悲伤蛙联名,"瑞幸咖啡, 瑞幸新品, 瑞幸, 瑞幸七夕限定, 瑞幸悲伤蛙联名",2022-08-02,未知,713,89,117
https://www.xiaohongshu.com/explore/62e88601000000001202881d?xsec_token=ABqJcaZV5c3WpqkVtFxLDKAo5A6OWbsDncg4wSqB5wPpk=&xsec_source=pc_user,瑞幸悲伤蛙联名纸袋！七夕不咕呱，一起瑞瑞瑞,luckin × 悲伤蛙联名杯套&纸袋 今日登陆全国门店！ 猜你们已经拿到了吧 	 ??七夕不咕呱，哇瑞喜欢你！ ??魔性炫酷又土潮，喜欢喜欢好喜欢还等啥，赶紧艾特你的对象&闺蜜一起瑞～ 	 悲伤蛙联名七夕限定,"瑞幸咖啡, 瑞幸, 瑞幸悲伤蛙联名, 瑞幸七夕限定",2022-08-02,未知,1494,219,543
https://www.xiaohongshu.com/explore/62e877f5000000001202ca22?xsec_token=ABqJcaZV5c3WpqkVtFxLDKAjQakNJtj4vXOVnDCdxhmak=&xsec_source=pc_user,luckin × @悲伤蛙 官宣就是今天！,大家都拿到新的杯套和袋子了吗？ 七夕不咕呱，蛙瑞喜欢你 一起来喝七夕限定吧~ 	 悲伤蛙联名,"瑞幸咖啡, 瑞幸, 悲伤蛙, 瑞幸悲伤蛙联名",2022-08-02,未知,735,63,261
https://www.xiaohongshu.com/explore/62e73bbf0000000012004da9?xsec_token=ABPBXusmVqU0Z9W0Ixpr2jg1PQOrqmQw1ZCmFmbTmDksY=&xsec_source=pc_user,朋友圈文案｜咖啡一端 好事不断,今天咖啡加冰 明天升职加薪 ??,"瑞幸咖啡, 瑞幸, 朋友圈文案, 打工人文案",2022-08-01,未知,674,95,259
https://www.xiaohongshu.com/explore/62e5fdd2000000001202b925?xsec_token=AB177DQFkZbzLE_GLOrs1vPDKjJtnqAQWHfoiOpxGqxNM=&xsec_source=pc_user,【倒计时】这是最后一张线索海报了……,坐等8月2日～,"瑞幸咖啡, 瑞幸",2022-07-31,未知,147,13,241
https://www.xiaohongshu.com/explore/62e4ad30000000001202b007?xsec_token=ABmq_8mmWfCCe8SYAbUGCSlCWdm-7uTHvnXzxkkoLyEN8=&xsec_source=pc_user,【线索二??】叫“哇瑞”是有很大原因的…,8月2日见~,"瑞幸咖啡, 瑞幸",2022-07-30,未知,362,23,417
https://www.xiaohongshu.com/explore/62e35b65000000001202fd88?xsec_token=AByY7-OOTL41GYZuK90fURF1bcowA82jRtY2lSRzsLsbw=&xsec_source=pc_user,??这只绿色生物将成为瑞幸七夕特别嘉宾…,8月2日见~,"瑞幸咖啡, 瑞幸",2022-07-29,未知,484,50,766
https://www.xiaohongshu.com/explore/62e20bb0000000001c0204a7?xsec_token=ABvOWT6Zl9BspYI4OiEX55y3Zpx6cl1KSq95phrsCfJnQ=&xsec_source=pc_user,又上新??居然是初恋青提同款大福诶??,9命！我们研发部小伙伴没有创作瓶颈是真的！ 【初恋青提大福】全国上市！先吃为敬?? 	 ???青提果酱+芝士乳酪，很像青提芝士冰激凌！ ??特别加入朗姆酒，层次丰富，味道更独特～ ??里面真的有果肉碎！吃出高级甜品的口感！ ??外皮绿绿的，和它的口感一样，清新治愈 	 不多说了怕你们流哈喇子闭眼冲就完事嗷！ 	 新品甜品,"瑞幸咖啡, 瑞幸, 瑞幸新品, 瑞幸甜品, 宝藏甜品分享",2022-07-28,未知,1043,160,281
https://www.xiaohongshu.com/explore/62e115e7000000001b0262ad?xsec_token=ABWqssDOV30snEj63Z8wU7oQTJ-zC1eo83hTSQq2OVlUg=&xsec_source=pc_user,找到了！打工鹿在我手机屏幕卖????气球！,谁能拒绝粉红色猪猪气球呢 图2??壁纸原图，欢迎自取～ 打工鹿,"瑞幸咖啡, 瑞幸, 猪猪气球, 瑞幸打工鹿",2022-07-27,未知,243,26,74
https://www.xiaohongshu.com/explore/62df8346000000001e016819?xsec_token=ABhTIkPlq1Z6RRFfZNv4Cs7-Y17oGLqGN-uv1Y4lEbOvA=&xsec_source=pc_user,??拜托大家不要看到封面就点进来…,不然就会忍不住反复观看十几次??,"瑞幸咖啡, 瑞幸",2022-07-26,未知,701,48,133
https://www.xiaohongshu.com/explore/62df548d000000001c017cd6?xsec_token=ABhTIkPlq1Z6RRFfZNv4Cs74myzo12ZQzGzLBDTbz1NSw=&xsec_source=pc_user,配送费0元！七夕新品6折！快来薅??,外送现在有活动！巨划算！看到这篇就是赚到！ 	 惊喜1??：6折喝??哇瑞草莓拿铁&百利甜莓拿铁 惊喜2??：生椰拿铁19.9??，还有多款6.2折起 惊喜3??：活动期间【配送费0】！！！ 	 ??活动时间：7月25日-28日 ???♀?家人们赶紧冲！免配送费可太香了！ 	 七夕限定,"瑞幸咖啡, 瑞幸, 瑞幸七夕限定",2022-07-26,未知,410,72,131
https://www.xiaohongshu.com/explore/62de37ec000000001c023580?xsec_token=ABy3PmDEF9xOMsvKTxcYC0w5BpgGpnWiYQX5fcBdql7eU=&xsec_source=pc_user,瑞幸出城市勋章了！广州限定！只在今天！,插播一个隐藏彩蛋今天（7月25日）是粤语日 我们给广州的友友准备了小惊喜?? ??只在今天，在广州任意门店完成一单 ?即可解锁【luck in 广州】限定电子勋章啦 	 新品,"瑞幸咖啡, 瑞幸, 瑞幸新品",2022-07-25,未知,404,26,246
https://www.xiaohongshu.com/explore/62ddf13d000000001b028de3?xsec_token=ABgmqorWJW-EhnZblIWCIiqQWYoJbIUPEZH1BMzRd_aR8=&xsec_source=pc_user,百利甜莓拿铁?哇瑞草莓拿铁??七夕限定！！！,马上七夕了！2款限定特饮提前给大家安排上 有酒有咖啡，还是草莓味！少女心DNA狠狠动了！ 	 ??百利甜莓拿铁 经典百利甜酒+真实草莓果汁+浓缩咖啡 口感浓醇而不腻，甜蜜微醺恰到好处～ 是你的草莓小甜“醺”没错了 	 ??哇瑞草莓拿铁 同样是真实草莓果汁融合丝绒厚奶 这款不含酒精，只有清甜的草莓味～ 满杯浓郁丝滑，是坠入爱河的浪漫味道 	 ??2杯都有敲粉嫩的奶油顶和彩虹棉花糖，颜值拉???！和你爱的ta或者小姐妹一起微醺一下～ 	 ??注意：【百利甜莓拿铁】含酒精原料，未成年人、驾驶人员、孕妇、酒精过敏者不宜饮用哦新品种草七夕限定,"瑞幸咖啡, 瑞幸, 瑞幸新品, 瑞幸种草, 瑞幸七夕限定, 百利甜酒",2022-07-25,未知,648,243,647
https://www.xiaohongshu.com/explore/62db640b000000001b01dbf0?xsec_token=AB3PDSHWspJ3V25KS26EbGX-BRiFEHyYg8BemihUgMmpM=&xsec_source=pc_user,均价6r??瑞幸宝藏甜品合集！！好吃不踩雷,点击来的友友恭喜你挖到宝了！ 小瑞掏出一份压箱底的宝藏甜品清单?? 网友亲测好吃??喜欢的宝快??住！收藏不迷路！ 	 ??图1：半熟芝士系列 ??图2：人气大福系列 ??图3：烘焙&欧包系列 ??图4：蛋糕&小点系列 	 ??价格和口感都在??啦！搭配咖啡换go巨划算！ 当早餐&午后小甜点都8错！饱腹&解馋统统满足！ 	 ??更多宝藏甜品不定期上新ing 记得多来看看小瑞动态～有好吃的第一个告诉大噶！ 	 不同门店可选择换go的商品有所不同，具体以门店库存为准哦～～ 	 甜品,"瑞幸咖啡, 瑞幸, 瑞幸甜品, 宝藏甜品分享, 甜品, 欧包",2022-07-23,未知,2746,655,271
https://www.xiaohongshu.com/explore/62da09de000000000e00498a?xsec_token=ABAxUZusZrRr5FFUS5F9QYI_fDVDivnxuAgCuDLvm1WRE=&xsec_source=pc_user,求助！！！被这道题难倒了！,大家帮忙看看这题咋选,"瑞幸咖啡, 瑞幸",2022-07-22,未知,1009,93,874
https://www.xiaohongshu.com/explore/62d8d0c5000000000f00388d?xsec_token=ABT0A6d5avvY4rZECdVOQHlIsT6KEjOyHyZwZkq6ec5UM=&xsec_source=pc_user,听我解释，冰萃咖啡真的不能去冰??,冰萃咖啡,"瑞幸咖啡, 瑞幸, 瑞幸冰萃咖啡",2022-07-21,未知,787,72,155
https://www.xiaohongshu.com/explore/62d61119000000000e004efb?xsec_token=ABTwLsNM8Hgvjr8cJpTe-7arnOdv-qAR76ZrIUy6mLCgw=&xsec_source=pc_user,瑞幸新品??布蕾奶芙瑞纳 奶奶的冰冰的！,爱瑞巴蒂??重要消息??今夏最后一款瑞纳冰 【布蕾奶芙瑞纳冰】全国上新啦 奶味星人闭眼冲！奶fufu本fu！ 	 ??焦糖布丁风味冰沙，蛋奶香味巨浓！ ??里面有超多奶冻，每一口都软QQ～ ??奶油顶+焦糖酱，只有香甜，不会腻！ ??整杯冰凉细腻，好像在吸冰激凌，解馋又消暑！ 	 瑞纳冰,"瑞幸咖啡, 瑞幸新品, 瑞幸, 瑞幸瑞纳冰",2022-07-19,未知,795,124,296
https://www.xiaohongshu.com/explore/62d4d3e9000000001200dbfb?xsec_token=ABdWOlgZeGGuIZ9JeBjYVT0j1eWg6q5Fne86Ki_w6r0Kk=&xsec_source=pc_user,如果你也喜欢冰萃，请一定读到最后??,冰萃咖啡,"瑞幸咖啡, 瑞幸新品, 瑞幸, 瑞幸冰萃咖啡",2022-07-18,未知,2014,99,2325
https://www.xiaohongshu.com/explore/62d4b581000000000102d40d?xsec_token=ABdWOlgZeGGuIZ9JeBjYVT0hFyw_0AHI0DDNrK-cFKC4o=&xsec_source=pc_user,进来冰冰冰一下！菠萝的海冰萃咖啡上新??,??太热热热热了！消暑神器必须安排到位！ 经典特调冰萃【菠萝的海冰萃咖啡】今日回归！ 可外送的欧气罐同步上市！都来凉快凉快 	 ??严选金钻菠萝，甜酸比拿捏得正正好?? ??每一口都能吸到菠萝果粒！清甜多汁 ??浓缩咖啡来自SOE咖啡豆，SCA80+精品级 ??0脂！一杯热量1.3个苹果，轻盈少负担～ ??菠萝果肉果汁+咖啡+气泡，冰透劲爽！ ??40°的天气来一杯！舌头好像在冲浪！过瘾！ 	 ??即日起，下单一杯菠萝的海冰萃还能解锁【菠萝的海】勋章哦 	 冰萃咖啡菠萝的海冰萃咖啡,"瑞幸咖啡, 瑞幸新品, 瑞幸种草, 瑞幸, 瑞幸冰萃咖啡, 瑞幸菠萝的海冰萃咖啡",2022-07-18,未知,212,95,248
https://www.xiaohongshu.com/explore/62d22fa8000000001200a4f2?xsec_token=ABSkiL1XXwM-5tPq0Q0A_D36PeV_fDzmWkE1YfdEawPnw=&xsec_source=pc_user,瑞吗瑞吗瑞了吗？接下联：_____,,"瑞幸咖啡, 瑞幸, 对对联, 对联, 文笔挑战",2022-07-16,未知,173,29,539
https://www.xiaohongshu.com/explore/62d0ecf8000000000102af88?xsec_token=ABqlDkpLr7Y8RNS4ORN-FjiSRja5tNNPHeph8hwKG0cM8=&xsec_source=pc_user,??偷心西梅拿铁真的是通便神器吗？,新品偷心西梅拿铁,"瑞幸咖啡, 瑞幸, 瑞幸新品, 瑞幸偷心西梅拿铁, 窜稀小妙招",2022-07-15,未知,457,43,140
https://www.xiaohongshu.com/explore/62cfa8b0000000001002b0b5?xsec_token=ABIgrdYjNFQ_uT19YWDN_fK-ZHe9glY6bO6idS2N1zbYc=&xsec_source=pc_user,鹿卡龙不用抽盲盒了??3种口味可自选??,传下去！！！人气超高的鹿卡龙有常规款啦?? 	 ??葡萄风味鹿卡龙 ??柚子芝士鹿卡龙 ??撞色玫瑰鹿卡龙 	 3种口味???自选～不用拼手气喜欢哪个冲哪个！ 	 鹿卡龙,"瑞幸咖啡, 瑞幸, 瑞幸鹿卡龙",2022-07-14,未知,371,33,290
https://www.xiaohongshu.com/explore/62cf79ab000000002103550b?xsec_token=ABIgrdYjNFQ_uT19YWDN_fK8MNc_V2IZRxHdTjn0e--J4=&xsec_source=pc_user,朋友圈文案｜没有咖啡的生活就像一盘散沙…,没有咖啡的生活就像一盘散沙 不用风吹 走两步就困了??,"瑞幸咖啡, 瑞幸, 朋友圈文案",2022-07-14,未知,497,109,408
https://www.xiaohongshu.com/explore/62cc05dc00000000210381c2?xsec_token=ABZ0APTopu05HCU_yOt3E-NXQVxd4Y_bLKEGB4NzD4wLg=&xsec_source=pc_user,这……是真的么( ????? ) ？,新品偷心西梅拿铁,"瑞幸咖啡, 瑞幸, 瑞幸新品, 瑞幸偷心西梅拿铁",2022-07-11,未知,258,16,389
https://www.xiaohongshu.com/explore/62cb7ac8000000002103852a?xsec_token=AB5vz5dJqOy7di-gB4YYpqeSt7TXT8PRTxD4R3tG4tTTA=&xsec_source=pc_user,??偷心西梅拿铁上新！是西梅威士忌味儿！,这一杯，肯定是你没喝过的奇妙滋味！ 创意特调【偷心西梅拿铁】今日上新！ 	 ??全新西梅威士忌风味，开启全新味觉感受！ ??【无酒精】只有淡淡酒感，清甜微微醺～ ?瑞幸原创「超级0卡糖工艺」特调，轻盈减负 ??北海道丝绒风味厚奶?IIAC金奖咖啡豆浓缩咖啡，还是熟悉的浓郁醇厚～ 	 ??清甜西梅+威士忌风味+奶咖 ??清新不腻的口感，粉墨渐变的颜值 ??你喜欢的样子它都有！一口偷走你的心！ 	 偷心西梅拿铁,"瑞幸咖啡, 瑞幸新品, 瑞幸种草, 瑞幸, 瑞幸偷心西梅拿铁",2022-07-11,未知,587,207,599
https://www.xiaohongshu.com/explore/62ca41360000000010028152?xsec_token=ABCV3_Ac4jcbjp36OlrsD8cv4PRsY04l1x4lTL8h9O594=&xsec_source=pc_user,瑞幸点单遇到“大无语”事件……,瑞纳冰,"瑞幸咖啡, 瑞幸, 瑞幸瑞纳冰",2022-07-10,未知,422,35,60
https://www.xiaohongshu.com/explore/62c95244000000002103c5cf?xsec_token=AB1NVLgDDIMiSucwEfOVH4McyuQLyqBZZlcIMaWFtlYPs=&xsec_source=pc_user,我来瑞幸工作只办三件事：____，____，____。,打工,"瑞幸咖啡, 瑞幸, 瑞幸打工, 我来这里我只办三件事",2022-07-09,未知,846,59,77
https://www.xiaohongshu.com/explore/62c8f208000000000102c6cd?xsec_token=AB4Qcgy1u0wSrKmaSboTIUa7JoKeJWJEl7K1Z6Cl_LfSI=&xsec_source=pc_user,好难选啊家人们！你们最期待哪个？,小瑞整理了最近风很大的3款饮品，好多友友希望我们出同款 	 现在选择权交给你们！选出一个人气王?? 我们安排上新！ 	 新品,"瑞幸咖啡, 瑞幸, 瑞幸新品, 薄荷拿铁",2022-07-09,未知,1118,99,7590
https://www.xiaohongshu.com/explore/62c7abf4000000000d025555?xsec_token=ABn39ewZd89fP7dQQdXsJJoSiWsYrn7cAVcXo8Zetu4-c=&xsec_source=pc_user,教大家DIY情侣手机壳！巨简单巨好看??,新品纸袋改造?,"瑞幸咖啡, 瑞幸, 瑞幸新品, diy, 瑞幸纸袋改造",2022-07-08,未知,735,218,94
https://www.xiaohongshu.com/explore/62c65ba8000000000d024367?xsec_token=ABkhkKy3NkcJbkBAHdACIYa8dkj0M4fwMZ9LkBZsnwghc=&xsec_source=pc_user,看图：你的瓦尔登蓝钻瑞纳冰喝对了吗？！,瓦尔登蓝钻瑞纳冰瑞纳冰,"瑞幸咖啡, 瑞幸, 瑞幸瓦尔登蓝钻瑞纳冰, 瑞幸瑞纳冰",2022-07-07,未知,322,31,62
https://www.xiaohongshu.com/explore/62c25cd6000000000303c01b?xsec_token=ABxeRljfUFb19pCDWgaoxLh1lJ6EQasQmdN8ojP-E4BzQ=&xsec_source=pc_user,瑞纳冰季第二波包装来啦??夏日出街必备??,来咯luckin coffee × CRAIG&KARL 第二波！ 冰饮杯、杯套&纸袋，正在陆续登陆全国门店～ 	 ??色彩明亮超吸睛！夏天就是要花花绿绿滴！ ??冰饮杯上面的小鹿也变样啦，和夏天更配～ ???这么酷的包装，uu们安排起来～～瑞！ 	 瑞纳冰,"瑞幸咖啡, 瑞幸新品, 瑞幸, 瑞幸瑞纳冰",2022-07-04,未知,575,64,127
https://www.xiaohongshu.com/explore/62c23fab00000000040038ec?xsec_token=ABxeRljfUFb19pCDWgaoxLh1i5XYlCe2vbe3zvGCM5474=&xsec_source=pc_user,颜值天花板??瓦尔登蓝钻瑞纳冰回归！！！,请大数据推给所有仙女！你们的蓝色治愈系冰沙 【瓦尔登蓝钻瑞纳冰】回来啦依旧美到炸裂！ 	 ??梦幻蓝色源自天然植物成分，含藻蓝蛋白 ??冷榨生椰浆注入，椰香浓郁，清冽冰爽 ??Q弹0脂原味晶球，如钻石般blingbling～ ???奶油顶+彩虹棉花糖，捕获你的少女心！ 	 口感和颜值一样能打！喜欢椰子味大胆炫它！ 绝美蓝色巨上镜，喝前记得先拍张美照瓦尔登蓝钻瑞纳冰,"瑞幸咖啡, 瑞幸新品, 瑞幸, 瑞幸瓦尔登蓝钻瑞纳冰",2022-07-07,未知,470,161,254
https://www.xiaohongshu.com/explore/62c10392000000002103a55c?xsec_token=ABb6HtRWuNWzirX9YkYAZh15MFCylb8tG_mYli_C1ifx8=&xsec_source=pc_user,在瑞幸上班第一天VS一年后…,打工,"瑞幸咖啡, 瑞幸, 瑞幸打工, 上班",2022-07-03,未知,19000,1601,305
https://www.xiaohongshu.com/explore/62bfb11e00000000060369ff?xsec_token=ABEwFvn4jmcapi5FClQreXvzGOXAdw-5kY36xP0XmEdyQ=&xsec_source=pc_user,返场调查??你们最希望谁回来？,掐指一算，大家疯狂许愿的饮品都陆续回来啦！ 还有哪些是你们希望回归的心头爱？ ??都来说说！争取今年夏天都返场！ 新品,"瑞幸咖啡, 瑞幸, 瑞幸新品",2022-07-02,未知,271,26,1239
https://www.xiaohongshu.com/explore/62be77c10000000002002adb?xsec_token=ABxwMphwkubOibfkLM5ZMiJ-h4sLHIDyn_WHiXY6QCTso=&xsec_source=pc_user,甜品上新｜三重莓莓瑞幸卷！巨！好！吃！,一定要安利给你们【三重莓莓瑞幸卷】！美貌与口感并存的神仙甜品！听名字都疯狂流口水?? 	 ??蔓越莓+草莓+树莓，三种莓果风味！ ??酸甜的莓子味融入稀奶油，卷进软软的蛋糕里 ??顶部还有冻干草莓颗粒！口感层次up up！ 整体口感湿软绵密，莓果味非常浓！！！酸甜可口不腻人！是幸福的味道～～～ 	 新品卷,"瑞幸咖啡, 瑞幸, 瑞幸新品, 瑞幸卷, 甜品",2022-07-01,未知,317,64,131
https://www.xiaohongshu.com/explore/62bd07ac000000000303f7cd?xsec_token=ABd-J2wiD2iyfON3Bv7hYpKI8THVA69YXkcTSGBOlxJ0w=&xsec_source=pc_user,??留下你的位置！我们去开店！！,截至今年6月，瑞幸全国门店数已突破7000家??共覆盖全国28个省级行政区！感谢家银们的喜爱和支持～ 如果你附近还没有，请把位置打在公屏上！我们开过去！,"瑞幸咖啡, 瑞幸",2022-06-30,未知,2597,218,19000
https://www.xiaohongshu.com/explore/62bbdce6000000000400659c?xsec_token=ABMQ3XsLEf2n2eRJg_4CpziaBtTSKQ-83FNus2wnk6PVA=&xsec_source=pc_user,家人们来投个票！哪款鹿卡龙最好吃？,??海盐小奥鹿卡龙 ??青柠莫吉托鹿卡龙 ??葡萄风味鹿卡龙 ??柚子芝士鹿卡龙 ??隐藏款-撞色玫瑰鹿卡龙 人气火爆的前三名，有机会变成常规款长期售卖哦～不用开盲盒，直接挑自己喜欢的吃！ 	 鹿卡龙,"瑞幸咖啡, 瑞幸, 瑞幸鹿卡龙",2022-06-29,未知,223,18,293
https://www.xiaohongshu.com/explore/62bbbb2200000000210395b7?xsec_token=ABMQ3XsLEf2n2eRJg_4Cpzie0eCtxiJ7-n_G2mREKZsh8=&xsec_source=pc_user,瑞幸意式拼配咖啡豆上新??手冲爱好者狂喜??,喜爱意式、热衷手冲咖啡的友友们看过来瑞幸意式拼配咖啡豆重磅上新啦！ 	 ??荣膺2021IIAC国际咖啡品鉴大赛金奖 ??甄选中国?云南、巴西、埃塞俄比亚3大产区阿拉比卡生豆 ??意大利BRAMBATI自动化高精度焙炒，风味更稳定 	 ??当季咖啡生豆新鲜烘焙，不是咖啡粉哦！！ ?不添加蔗糖/香精等添加剂，现磨口感更醇香 ??深度烘焙，口感浓醇，有明显焦糖&坚果风味 	 ??手冲、法压壶、意式咖啡机等都可冲泡～ ??做意式基底拉花or直接冲泡，随意发挥享受一杯自己亲手做的好咖啡～,"瑞幸咖啡, 瑞幸, 咖啡豆",2022-06-29,未知,150,64,84
https://www.xiaohongshu.com/explore/62ba856b0000000021034c72?xsec_token=ABYH-yr8u7EACQML4Sfj_6hh1OXYrN9iMi5CwoxYLqeQQ=&xsec_source=pc_user,鹿卡龙火了！打工鹿居然做出图2这种事……,这才是真·鹿卡龙新品鹿卡龙打工鹿,"瑞幸咖啡, 瑞幸, 瑞幸新品, 瑞幸鹿卡龙, 瑞幸打工鹿",2022-06-28,未知,187,10,73
