帖子链接,标题,正文,标签,发布时间,发布地点,点赞数,收藏数,评论数
https://www.xiaohongshu.com/explore/6788b1bb000000001c00e19c?xsec_token=ABnh3EQBggjMb3P-UjWDJ-nih5LHNFDd3-yHX12BzjGH0=&xsec_source=pc_user,瑞幸史上海拔最高门店！拉萨悠享店今日开业,瑞幸咖啡海拔最高的悠享店，也是拉萨地区的首家悠享店 📍拉萨-大昭寺八廓街店 今日起，正式开业 	 我们把瑞幸咖啡，带到了海拔高达3650米的高原上 门店的整体风格以藏式建筑、色彩、图案为灵感 店面入口采用传统的梯形门框设计，室内天花板运用斗拱造型，桌椅则选用色彩鲜艳的藏式传统图案布艺，随处可见藏族文化的元素 	 详细地址📍拉萨市城关区八廓街道读仁路48号 LUCK IN LASA💙欢迎大家光临 	 ﻿﻿ ﻿﻿ ﻿﻿ ﻿﻿ ﻿悠享店﻿ ﻿﻿,"瑞幸咖啡, 新店开业, 拉萨咖啡新地标, 拉萨特色悠享店, 瑞幸咖啡悠享店, 大昭寺",2025-01-16,未知,4110,542,689
https://www.xiaohongshu.com/explore/67874b04000000002100159e?xsec_token=ABnPCEd5522dmMZ3EsNoJF_157yUFXeGpslijatuDwUMw=&xsec_source=pc_user,今日·𝗼𝗼𝘁𝗱▪◾◼,今日份的OOTD⬛来自全新升级的大黑杯 ﻿﻿ 系列升杯，即可获得同款大黑杯 加豆不加价，容量提升30% 还有11款产品可以升级耶加雪菲咖啡豆哦 ﻿﻿  ﻿﻿  ﻿﻿  ﻿﻿  ﻿﻿  ﻿﻿,"耶加雪菲, 看澳网喝瑞幸, 瑞幸咖啡, 瑞幸大黑杯, 瑞幸SOE, SOE咖啡, 澳网时间到",2025-01-16,未知,192,18,57
https://www.xiaohongshu.com/explore/678751d200000000190324e3?xsec_token=ABnPCEd5522dmMZ3EsNoJF_9lV9qikv9KM9WpFzpHCneQ=&xsec_source=pc_user,榜单揭晓🏆不知道喝哪杯的进来码住！,🏆最受大家欢迎的大黑杯榜单揭晓🏆 ☕SOE·耶加雪菲系列免费升杯 加豆不加价，容量提升约30% 	 ☕11款经典产品+2元升级SOE耶加雪菲豆 部分热饮选项还可解锁澳网主题大黑杯 详情活动规则可见图4 	 ﻿﻿ ﻿﻿ ﻿﻿ ﻿﻿ ﻿﻿ ﻿﻿ ﻿﻿,"瑞幸咖啡, 瑞幸大黑杯, 看澳网喝瑞幸, 美食小宇宙, 澳网时间到, SOE咖啡, 今天喝什么",2025-01-15,未知,150,37,64
https://www.xiaohongshu.com/explore/67864ac60000000001009209?xsec_token=ABK46M_nQl2M0G7A2euxJKN_AYVQKZY8qiGjmU5gOzHMc=&xsec_source=pc_user,SOE限时升杯！加豆、加量、不加价☑️,﻿﻿ 全线升级 加豆不加价，相较于小黑杯而言，容量和咖啡粉量都增加啦 统统UP🆙UP🆙UP🆙 如需升杯，可在点单页面选择【16oz】选项 热饮选项升杯时，还可解锁大黑杯款 	 ﻿﻿ ﻿﻿,"瑞幸大黑杯, 瑞幸大黑杯, SOE咖啡",2025-01-14,未知,78,12,70
https://www.xiaohongshu.com/explore/67861622000000000100180d?xsec_token=ABK46M_nQl2M0G7A2euxJKN3aQ4NVjUsK15xmhIdjbkOs=&xsec_source=pc_user,🎶小小的包，是萌鼓包🎶,澳网联名萌鼓包还有谁没安排上🙋‍ 亲测做耳机包很合适，大小刚刚好 用来装出门用的饰品零碎也很方便哦！ 别在包上或者身上，时尚满分💯 	 ﻿﻿ ﻿﻿ ﻿﻿ ﻿﻿ ﻿﻿,"看澳网喝瑞幸, 瑞幸咖啡, 萌鼓包, 耳机包, 澳网时间到",2025-01-14,未知,102,28,44
https://www.xiaohongshu.com/explore/678600460000000001000ee4?xsec_token=ABK46M_nQl2M0G7A2euxJKN73OPwU80JFIFy7Glu6Ulr0=&xsec_source=pc_user,Hi，new friends！,"I heard that many new friends have come here recently. I'm luckin coffee, nice to meet you all!We are a coffee brand, and my job is to provide you with better coffee Dear friends, don't miss our recent luckin black cup upgrade event. It's upgraded from 12oz to 16oz, but completely free 	 ﻿﻿ ﻿﻿ ﻿﻿","瑞幸咖啡, luckincoffee, tiktokrefugee",2025-01-14,未知,13000,974,11000
https://www.xiaohongshu.com/explore/678482060000000001002b0e?xsec_token=ABknvfSaCc1ClVXQExXRAiKqy9NX99zCDyvJty2qFXwmU=&xsec_source=pc_user,再度携手澳网▶️一起揭开幸运真相,🎾作为澳大利亚网球公开赛中国及东南亚官方独家咖啡合作伙伴 我们深信LUCKY SHOT来自于「用专注的心 做专注的事」 手握小蓝杯，一起揭开幸运真相▶️ 	 ﻿﻿ ﻿﻿ ﻿﻿ ﻿﻿ ﻿﻿,"看澳网喝瑞幸, 澳网2025, 澳网时间到, 瑞幸大黑杯, 商竣程",2025-01-13,未知,97,14,13
https://www.xiaohongshu.com/explore/678119ef000000001703f87a?xsec_token=ABkuWINx_b3J9-E2yvG7W1Ntawo0Pq6lGSKI2aosiNXWQ=&xsec_source=pc_user,限时免费升杯❗点击查看澳网联名大黑杯,看澳网，喝瑞幸 澳网联名款包装，今日起上市 	 SOE·小黑杯🆓限时免费升杯 👉热饮选项时，还🉑升级大黑杯 此外，还有2款联名杯套➕️1款联名纸袋限定上市哦 指定咖啡券包🉐联名萌鼓包or联名酷饮杯 实物超有质感拉满💯杯口还做了特别造型（见图9️⃣） 	 ﻿﻿ ﻿﻿ ﻿﻿ ﻿﻿ ﻿﻿ ﻿﻿ ﻿﻿,"看澳网喝瑞幸, 瑞幸咖啡, 瑞幸大黑杯, 澳网时间到, 瑞幸新品, 瑞幸纸袋, 杯套",2025-01-13,未知,273,48,112
https://www.xiaohongshu.com/explore/678117940000000017039f20?xsec_token=ABkuWINx_b3J9-E2yvG7W1Nu15VrcSF-54q9yHY3QU2U8=&xsec_source=pc_user,加豆不加价⏳小黑杯全面升级大黑杯❗️,瑞幸咖啡大黑杯全新登场 容量比小黑杯约提升30%🆙🆙🆙咖啡粉量也有所增加哦 注意看👀小黑杯变了！ 配色与设计双重升级，容量更大 灵感源自澳网赛场，唤醒网球击穿瞬间的张力，网罗更多幸运 限时活动⏳ 🆓SOE·耶加雪菲，免、费、升、杯🆓 容量上升⏫︎热饮还可解锁新款大黑杯包装 还有11款经典人气产品 ➕️2元，可升级成SOE·耶加雪菲咖啡豆哦 看澳网，喝瑞幸 大杯喝，更过瘾 ﻿﻿ ﻿﻿ ﻿﻿ ﻿﻿ ​​​ ﻿﻿ ﻿﻿ ﻿﻿﻿,"看澳网喝瑞幸, 澳网2025, 瑞幸咖啡, 澳网时间到, SOE咖啡, 瑞幸大黑杯, 耶加雪菲",2025-01-14,未知,611,137,470
https://www.xiaohongshu.com/explore/6782789a000000000203d6a2?xsec_token=ABvQbPPFlq_9q1eoCyITzoLdq4EA6izX5UcAJEdStb0KU=&xsec_source=pc_user,下滑暂停⏸️先夸夸今年努力的自己,人，又过了一年，你辛苦了 年初的时候，我们从﻿﻿ 相见 年末的时候，我们的最后一杯也是﻿﻿ 在这一年里， 你已经很“橙”功了！ 	 感谢博主﻿@小猪咪蹦子﻿ 授权 	 ﻿﻿ ﻿﻿ ﻿﻿ ﻿﻿ ﻿﻿ ﻿分享﻿ ﻿﻿ ﻿﻿,"褚橙拿铁, 褚橙拿铁, 瑞幸咖啡, 褚橙拿铁, 治愈系, 表情包, 美食小宇宙, 表情包分享, 猫咪表情包, 治愈",2025-01-12,未知,823,139,173
https://www.xiaohongshu.com/explore/6782770b000000001703a72e?xsec_token=ABvQbPPFlq_9q1eoCyITzoLWe3Lg50Q8xeoPHRl8fHaJY=&xsec_source=pc_user,还有谁没见过2024年的霸屏合集📅,2024年陪大家一起走过了春💐夏☀️秋🍂冬❄️ 再一起回顾下这一年里的四季王者霸屏彩蛋吧 	 解锁方式📄 【我的等级】达到黑金鹿/九色鹿，在门店扫🐎取餐时即可解锁霸屏效果哦 不同时间的霸屏效果可能会有所不同，今年份的霸屏千万别错过啦 	 ﻿﻿ ﻿﻿ ﻿﻿ ﻿﻿,"王者霸屏, 瑞幸咖啡, 带上兴趣出门, 美食小宇宙",2025-01-12,未知,184,19,38
https://www.xiaohongshu.com/explore/678114f70000000017038819?xsec_token=ABkuWINx_b3J9-E2yvG7W1NpaGBlkYPsBSzI4gxQk4VcU=&xsec_source=pc_user,去东北前 VS 去东北后,东北会惩罚每一个不抗冻的人 和抗冻的梨🍐 无需去东北，﻿﻿ ！ 	 ﻿﻿ ﻿﻿ ﻿﻿ ﻿﻿ ﻿﻿,"我在瑞幸喝冻梨, 瑞幸咖啡, 大冻梨拿铁, 大冻梨美式, 大冻梨轻乳茶, 美食小宇宙",2025-01-12,未知,115,22,40
https://www.xiaohongshu.com/explore/6780f973000000000203fc8e?xsec_token=AB6yqKSk-axsA5X6srFwFAoeIqEVn8azPv5HusF75TE1g=&xsec_source=pc_user,出征澳网💪和商竣程一起幸运在握,﻿﻿ 火热进行中！ 🎾瑞幸咖啡与品牌健康大使商竣程继续携手，共同开启新篇章！ 💪出征澳网，幸运在握！ 	 ﻿﻿ ﻿﻿ ﻿﻿ ﻿﻿,"澳网2025, 看澳网喝瑞幸, 澳网2025, 澳网时间到, 瑞幸咖啡",2025-01-11,未知,86,11,35
https://www.xiaohongshu.com/explore/6777a0dc000000000b021cd1?xsec_token=ABKZjUvYuXlksGGBd_J2R01T7EZwnVIRdh3cMWkCiOJDc=&xsec_source=pc_user,纸袋先别扔🎡爆改摩天轮教程送上！,喝完咖啡的纸袋先不要扔 🎡手把手教你用纸袋改造mini摩天轮 正方形纸张的大小 可以根据大家想要的摩天轮尺寸自行调节哦 感谢﻿﻿@弦oO﻿ 博主授权 ﻿﻿ ﻿﻿ ﻿﻿ ﻿﻿ ﻿﻿ ﻿折纸﻿ ﻿﻿﻿,"瑞幸纸袋改造, 瑞幸咖啡, diy, 折纸教程, 摩天轮, 摩天轮折纸, 纸袋改造",2025-01-10,未知,22000,11000,165
https://www.xiaohongshu.com/explore/677f5cb8000000000203d1d8?xsec_token=ABzwbfo_BprVTI_uWyYdTYvRsLTUhSpCqYyIv32a_lme4=&xsec_source=pc_user,谁懂！草莓和冬天的适配度真的很高！！,🍓谁懂草莓的果张力有多强！！！ 不会太酸也不会太甜，平衡得刚刚好，还自带清新的果香 ❄️冬天一到，就知道是草莓的季节到了 😋今年除了草莓以外，别忘了来杯一大口草莓果茶 不仅能喝到清甜的草莓汁，还能（嚼嚼嚼）吃到草莓果肉（嚼嚼嚼） 由于草莓本身口感偏甜 大家选择不另外加糖或者微甜即可哦 感谢博主﻿﻿@半罐话梅﻿ ﻿@冰茄汤﻿ ﻿@三十﻿ 授权 ﻿﻿ ﻿﻿ ﻿﻿ ﻿﻿ ﻿的季节﻿ ﻿﻿ ﻿﻿﻿,"一大口草莓果茶, 瑞幸咖啡, 草莓, 美食小宇宙, 草莓的季节, 冬天的快乐是草莓, 瑞幸新品",2025-01-09,未知,255,30,142
https://www.xiaohongshu.com/explore/677f3c8700000000010024dd?xsec_token=ABzwbfo_BprVTI_uWyYdTYvaMaOdgFW3AAQ_KPMzUS548=&xsec_source=pc_user,第一个在瑞幸纸袋上写字的人是天才！,不敢想象在降温的日子里 同时收到一杯暖暖的咖啡 和好朋友写的纸袋的人会有多幸福 快艾特你的朋友进来学！ 感谢博主﻿@Falešný poplach.﻿ 授权 	 ﻿﻿ ﻿﻿ ﻿﻿ ﻿﻿ ﻿﻿,"瑞幸咖啡, 瑞幸纸袋改造, 2024值得奖奖, 纸袋写字, 手写的浪漫",2025-01-09,未知,2944,441,173
https://www.xiaohongshu.com/explore/677de52d000000001a01c1e0?xsec_token=ABbwGYK_KtUjE5MPclQQuaWE7jlhHjpq0p__LE5gb_9sA=&xsec_source=pc_user,新年要到了⏳先送一波新、年、礼、盒❗️,谁在想要小瑞家的同款新年礼盒👂 🫡马上给大家安排上❗️ 偷偷告诉大家，这次的礼盒真的很大大大大大！ 除了春节少不了的对联、福字、红包🧧 还有瑞幸定制款行李箱、费尔岛同款花纹的针织毯等 参与方式🎁点击图片下方【限时抽奖】就有机会Get 活动时间⏰2025-01-08 00:00:00至2025-01-14 00:00:00 开奖时间⏰2025-01-14 15:00:00 ﻿﻿ ﻿﻿ ﻿﻿ ﻿﻿ ﻿﻿ ﻿﻿,"瑞幸咖啡, 新年礼盒, 新年要有仪式感, 增添点年味儿, 抽奖活动, 宠粉",2025-01-08,未知,1820,1127,1719
https://www.xiaohongshu.com/explore/677cbf61000000001800cc98?xsec_token=ABQLdR2r_pMzciPipEd3BwHdlrZhzNigBu-xp6_YkOh5g=&xsec_source=pc_user,一代人有一代人的腊八粥！谁敢喝！,谁试过用美式熬粥❓ 虽然味道不太好，但小编们还是每人一碗一口闷了😋 会做饭的同事表示应该用半杯冰美式＋水＋冰糖 有没有勇士敢尝试一下👀 	 ﻿﻿ ﻿﻿ ﻿﻿ ﻿﻿ ﻿﻿ ﻿﻿ ﻿﻿,"瑞幸咖啡, 腊八粥己备好, 腊八粥, 腊八节, 腊八, 美食小宇宙, 不一样的冰美式",2025-01-07,未知,264,20,134
https://www.xiaohongshu.com/explore/677ab1d8000000000b02280f?xsec_token=ABFUUGKRfx4IToAMnf9vF2vYYGtOoPyaYRlki1LotYlPs=&xsec_source=pc_user,澳网开赛啦🎉和小蓝杯一起幸运在握,🎾﻿﻿ 今日开赛！ ☕瑞幸咖啡连续2年担任「澳大利亚网球公开赛中国及东南亚官方独家咖啡合作伙伴」 💙与澳网和瑞幸咖啡品牌健康大使商竣程一起，幸运在握 	 ﻿﻿ ﻿﻿ ﻿﻿,"澳网2025, 看澳网喝瑞幸, 澳网2025, 瑞幸咖啡",2025-01-06,未知,180,37,99
https://www.xiaohongshu.com/explore/6777c377000000000900e19b?xsec_token=ABKZjUvYuXlksGGBd_J2R01QjgrDPN_TAoku0c1ZXLM1w=&xsec_source=pc_user,新品上市🥰冬天的幸福，来自一大口草莓,谁能拒绝冬天的第一口草莓🍓 ﻿﻿ 清爽上市 每杯能喝到20颗草莓， 能喝到真实草莓果肉，超大杯，超满足😋 再配上茉莉花茶底，真的巨巨巨巨清爽！ 草莓脑袋们冲冲冲 	 ﻿﻿ ﻿﻿ ﻿﻿ ﻿﻿ ﻿﻿ ﻿﻿﻿,"一大口草莓果茶, 瑞幸咖啡, 瑞幸新品, 冬天的快乐是草莓, 草莓的季节, 草莓, 美食小宇宙",2025-01-06,未知,658,189,324
https://www.xiaohongshu.com/explore/67779e1b000000000b00f37e?xsec_token=ABKZjUvYuXlksGGBd_J2R01YPlB0he8iofO_pFB1R-itQ=&xsec_source=pc_user,如果瑞幸开在冰雪大世界......,小寒到了，天气也是越来越冷❄️ 嘎嘎冷的日子，要是配上一杯咖咖好喝的大冻梨就更合适了！ 	 ﻿﻿ ﻿﻿ ﻿﻿ ﻿﻿ ﻿﻿ ﻿﻿ ﻿﻿,"小寒, 瑞幸咖啡, 大冻梨拿铁, 大冻梨美式, 我在瑞幸喝冻梨, 冰雪大世界, AIGC",2025-01-05,未知,561,37,107
https://www.xiaohongshu.com/explore/67779c27000000000b017941?xsec_token=ABKZjUvYuXlksGGBd_J2R01R6Bqz5QvkJ6ReH1LYNfL1w=&xsec_source=pc_user,和代言人易烊千玺一起，来看「小小的我」,再渺小的我，也都是完整的我 和代言人易烊千玺一起，来看「小小的我」 	 ﻿﻿ ﻿幕后纪录片 ﻿ ﻿ ﻿﻿ ﻿﻿ ﻿﻿,"电影小小的我, 小小的我, 电影小小的我幕后纪录片, 易烊千玺的费尔岛拿铁, 易烊千玺代言瑞幸咖啡, 冬天就喝烤椰拿铁, 瑞幸咖啡",2025-01-04,未知,4936,192,225
https://www.xiaohongshu.com/explore/6778e3780000000014027df8?xsec_token=AB6GM0vRw2Gnt8K9d5FYT4lI4u7l21lgSRekMpSuY2K3k=&xsec_source=pc_user,❓大家喝橙C美式的时候，第一口搅拌吗,注意看👀这是 里 杜城在品尝橙C美式时没有搅拌的画面 也想问问大家🤔平时是怎么喝 的呢？ 小编推荐方法 ➡️第1口不搅拌，美美的喝上一口橙汁 ➡️再搅拌均匀，一口同时享受到橙香和咖啡香😎,"猎罪图鉴2, 橙C美式, 瑞幸咖啡, 猎罪图鉴2, 橙C美式",2025-01-04,未知,1194,80,208
https://www.xiaohongshu.com/explore/677753a3000000000900e522?xsec_token=ABKZjUvYuXlksGGBd_J2R01ThWgIdYjKgNBjauh3VO2OM=&xsec_source=pc_user,左滑>>>查看答案,橙退了，这一退，就是一杯汁 这一退，就变成了真的含橙汁的﻿﻿ 	 ﻿﻿ ﻿﻿ ﻿﻿ ﻿﻿ ﻿﻿ ﻿咖啡﻿,"橙C美式, 瑞幸咖啡, 今天喝什么, 美食小宇宙, 果咖, 美式, 美式咖啡",2025-01-03,未知,407,75,230
https://www.xiaohongshu.com/explore/67726ca7000000000b022630?xsec_token=ABuliv1qJzRptqAUSp_ORB8VZ3soFZKS3-ShzZUCNBkak=&xsec_source=pc_user,杯子怎么收纳❓请看此条VCR,主题杯收藏起来实在是太太太太多！ 直接收起来太占地扔掉又实在太可惜❓ 试试这么收纳！图案不浪费，也不用担心放不下啦！ 感谢﻿@小废物种草日记﻿ 博主的授权 新的一年啦，快用这种方法开启今年份的收藏吧 	 ﻿﻿ ﻿﻿ ﻿﻿ ﻿﻿ ﻿﻿,"瑞幸咖啡, 瑞幸周边, 周边收纳, 我的收纳分享, 2024值得奖奖",2025-01-02,未知,43000,13000,607
https://www.xiaohongshu.com/explore/6773dde8000000000b020f60?xsec_token=ABXt4tnk87Gz9LmcDySy54_tbKE5wYgEDO2QudR8bKlvA=&xsec_source=pc_user,瑞幸咖啡首批加入《苔花公约》,苔花如米小，也学牡丹开 非常荣幸成为第一批加入《苔花公约》的品牌 瑞幸会积极履行公约，为残障人士提供力所能及的帮助，给残障人士公平就业的机会 	 ﻿﻿ ﻿﻿ ﻿﻿,"电影小小的我, 小小的我, 瑞幸咖啡",2025-01-01,未知,19000,1207,987
https://www.xiaohongshu.com/explore/6773cc69000000000800f281?xsec_token=ABXt4tnk87Gz9LmcDySy54_nJd_8VsVsEs8uoX1Tqyao8=&xsec_source=pc_user,元旦快乐❤️,新的一年，来一份刚刚好的甜 新年第一杯，来喝褚橙拿铁🍊 	 ﻿﻿ ﻿﻿ ﻿﻿ ﻿﻿,"元旦快乐, 褚橙拿铁, 瑞幸咖啡, 今天你喝咖啡了吗",2025-01-01,未知,155,17,62
https://www.xiaohongshu.com/explore/6773c86e000000000b0166f8?xsec_token=ABXt4tnk87Gz9LmcDySy54_jKWw1U1QST12yW0-naCM0U=&xsec_source=pc_user,🎉2025，和易烊千玺一起新年瑞幸,2025，和易烊千玺 继续一起﻿﻿ 	 ﻿﻿ ﻿ ﻿﻿ ﻿﻿,"新年瑞幸, 易烊千玺的费尔岛拿铁, 易烊千玺代言瑞幸咖啡, 冬天就喝烤椰拿铁, 瑞幸咖啡",2025-01-01,未知,5438,267,377
https://www.xiaohongshu.com/explore/6773c36c000000000800c29e?xsec_token=ABXt4tnk87Gz9LmcDySy54_pB6aRMbjb4PJ_lAXOveOTg=&xsec_source=pc_user,🎉2025，和刘亦菲一起新年瑞幸,🎉2025，和刘亦菲 继续一起 	 ﻿﻿ ﻿﻿ ﻿﻿,"新年瑞幸, 刘亦菲代言瑞幸咖啡, 和刘亦菲一起喝轻轻茉莉, 瑞幸咖啡",2025-01-01,未知,2467,107,338
https://www.xiaohongshu.com/explore/6773c0eb0000000009017aca?xsec_token=ABXt4tnk87Gz9LmcDySy54_vHVh95yRwj2IxBzw5vObyE=&xsec_source=pc_user,跨年夜🎆今年份的烟花，来自瑞门,零点啦⏰新年到啦 ㊗️大家新年瑞幸🎉 一起接这份2️⃣0️⃣2️⃣5️⃣的烟花🎆 	 要有仪式感,"瑞幸咖啡, 跨年, 烟花, 开始期待跨年了, 跨年要有仪式感, 许个愿吧, 点亮新一年, 迎接新的一年",2025-01-01,未知,359,33,103
https://www.xiaohongshu.com/explore/6773b964000000000900d2be?xsec_token=ABXt4tnk87Gz9LmcDySy54_jJX-J49BUINMr7D5szBZ4o=&xsec_source=pc_user,注意，这杯不加班,产季限定⏳ 褚橙拿铁温馨提示 售完就下班欲喝从速哦 	 ﻿﻿ ﻿﻿ ﻿﻿ ﻿﻿ ﻿﻿,"褚橙拿铁, 瑞幸联名褚橙, 新年第一杯, 跨年快乐, 美食小宇宙",2024-12-31,未知,188,19,105
https://www.xiaohongshu.com/explore/67738bfe000000000800dfa4?xsec_token=ABXt4tnk87Gz9LmcDySy54_slB1xI2oYFz3kjZIzzi-1M=&xsec_source=pc_user,板凳已就位！请解锁它的多种打开方式,还有谁不知道新年小板凳的妙用！ 天选盲盒谷美🈶 倒放时，还可做手机支架 听说大家还有更多新鲜玩法 👀让小瑞看看大家拍的小板凳！ 	 ﻿﻿ ﻿﻿ ﻿﻿ ﻿﻿ ﻿﻿,"瑞幸联名褚橙, 褚橙拿铁, 板凳, 挂件, 瑞幸新品",2024-12-31,未知,150,17,46
https://www.xiaohongshu.com/explore/67721871000000000900e2a4?xsec_token=ABuliv1qJzRptqAUSp_ORB8dATGXos1PimK2lEcSe0UrQ=&xsec_source=pc_user,﻿孟佳邀你喝褚橙拿铁🍊祝你心想事成,﻿@孟佳xxMJxx﻿ 邀请你一起喝杯「褚橙拿铁」 祝你新年心想事成🍊 跨年之夜，一起闪耀四方！ 	 ﻿﻿ ﻿﻿ ﻿﻿ ﻿﻿,"瑞幸咖啡, 孟佳, 褚橙拿铁, 瑞幸联名褚橙",2024-12-31,未知,818,126,216
https://www.xiaohongshu.com/explore/67721c9a000000000b00c0d9?xsec_token=ABuliv1qJzRptqAUSp_ORB8QtyHyZyztnhlFcgM4TNDWM=&xsec_source=pc_user,一定不要错过！新年一定要吃的甜品！！,年末了，给自己的新年一点甜 来试试小瑞家的新年限定甜品，为自己的2025添个好彩头 	 新的一年㊗️好柿发生 新年限定🏷️新年好柿大福 超超超超超超级可爱的柿子大福，看着就喜庆 味道也是一如既往地好吃！ 柿香漫溢，一口爆浆 	 新的一年㊗️大橘大利 新年限定🏷️大橘大利福袋蛋糕 柠檬味的动物奶油，酸甜不腻 两层绵软如云的戚风蛋糕间，包裹着吃得到的橘子果肉🍊 外层的饼皮味道类似于千层蛋糕皮，裹住内陷的不同口感 	 ﻿﻿ ﻿﻿ ﻿﻿ ﻿﻿ ﻿﻿ ﻿﻿ ﻿﻿ ﻿﻿,"瑞幸咖啡, 瑞幸新品, 美食日常, 美食小宇宙, 大福, 瑞幸轻食, 新年好柿大福, 大橘大利福袋蛋糕",2024-12-31,未知,163,38,40
https://www.xiaohongshu.com/explore/67720242000000000b023569?xsec_token=ABuliv1qJzRptqAUSp_ORB8dzv-Wk6vUYhZvff8Z2voCo=&xsec_source=pc_user,官方科普📕为什么这次的周边是板凳❓,❓为什么这次的周边是板凳 在云南哀牢山，每一户种植褚橙的农家都有这么一个小板凳🪑 农忙时，村民用来抽空休息 农闲时，村民用来摆放草帽等随身物件 同时，在它的反面我们还印了一个“稳”字，祝愿你新的一年「四平八稳」 	 当然，新年的祝福寓意，我们也不止于此 今年，我们还为大家准备了刮刮卡 每一张刮出来的内容里，都承载了我们对大家的新年祝愿和礼物🎁 	 ﻿﻿ ﻿﻿ ﻿﻿ ﻿﻿ ﻿﻿ ﻿﻿ ﻿﻿,"瑞幸咖啡, 褚橙拿铁, 瑞幸联名褚橙, 刮刮卡, 褚橙, 哀牢山, 新年祝福",2024-12-30,未知,1137,201,658
https://www.xiaohongshu.com/explore/67720ad9000000000b016bc4?xsec_token=ABuliv1qJzRptqAUSp_ORB8Uji0lSG2LZ547kjmxCvNNo=&xsec_source=pc_user,在哀牢山里，藏着褚橙成长的秘密,在哀牢山里，藏着褚橙成长的秘密🍊 褚橙的长大，离不开这里的一切 褚橙长大了，这就把幸福带给你 	 ﻿﻿ ﻿﻿ ﻿﻿ ﻿﻿ ﻿﻿,"瑞幸联名褚橙, 褚橙拿铁, 瑞幸咖啡, 哀牢山, 褚橙",2024-12-30,未知,336,66,32
https://www.xiaohongshu.com/explore/6771ffeb000000000b00da6e?xsec_token=ABJFcSR-yd1IYP3VONKNG094B1b5amaJO9ojnHPq4ln4A=&xsec_source=pc_user,报💡你的年度账单，生成成功📜,报告！尊贵的瑞幸会员们 您的2024年度瑞幸咖啡账单已生成成功 请自行获取查看 👀看看你的2024年度之瑞是哪杯❓ 欢迎瑞宝们在评论区晒出你们的年度总结哦 	 ﻿﻿ ﻿﻿ ﻿﻿ ﻿﻿ ﻿﻿ ﻿﻿,"瑞幸咖啡, 年度账单, 年终总结, 盘点, 2024值得奖奖, 美食小宇宙",2024-12-30,未知,148,28,125
https://www.xiaohongshu.com/explore/67712e670000000014024f02?xsec_token=ABJFcSR-yd1IYP3VONKNG09_sUFrnKl31k89crAiT5eVc=&xsec_source=pc_user,瑞幸年末最后一波周边🆕祝你四平八稳,褚橙拿铁带着今年年末最后一波周边来啦❗️ 	 指定套餐🉐小凳子挂件一个 ㊗️你新的一年四平八稳、好事就位 同一订单中，任意两杯饮品，🉐刮刮卡一张 看看谁有机会抱走9️⃣9️⃣杯瑞 当然啦，也少不了杯套和纸袋🆕 	 年末的最后一波周边 是小瑞提前送来的新年祝福 2️⃣0️⃣2️⃣5️⃣，祝大家心想事🍊,"褚橙拿铁, 瑞幸联名褚橙, 周边, 瑞幸新品, 挂件, 刮刮卡, 新年祝福",2024-12-30,未知,456,91,236
https://www.xiaohongshu.com/explore/67712b8d00000000140279a2?xsec_token=ABJFcSR-yd1IYP3VONKNG099u3ghhw72hqekU5pL1Z-nU=&xsec_source=pc_user,褚橙回归🍊新一年，甜刚好,瑞幸咖啡 x 褚氏农业联名款 🍊褚橙拿铁🍊诚意回归 年度产季限定，喝一杯少一杯⏳ 	 哀牢山的路很绕⛰️溢满了爷爷背篓里的橙子香 橙子香很浓🍊沿着山路飘进了每一杯咖啡里 	 每杯褚橙拿铁都含真实褚橙汁 清新橙香与咖啡融合得刚刚好 	 新一年，喝杯褚橙拿铁 万事甜刚好,"褚橙拿铁, 瑞幸联名褚橙, 瑞幸咖啡, 回归, 拿铁, 冬天当然要吃橙子啦, 褚橙",2024-12-30,未知,440,113,523
https://www.xiaohongshu.com/explore/67712bc70000000014023aed?xsec_token=ABJFcSR-yd1IYP3VONKNG098L-4lZLlqV5kniUjgj-xHk=&xsec_source=pc_user,周边攻略|新一年的幸运，抢先看,辞旧迎新，心想事橙 新年的幸运物料周边，明日即将送达 快快码住攻略，迎接新年小幸运,"瑞幸咖啡, 褚橙拿铁, 周边攻略, 瑞幸周边, 联名, 瑞幸新品",2024-12-29,未知,531,117,272
https://www.xiaohongshu.com/explore/6770c94d000000001300e4fc?xsec_token=ABb93TSk31WtGClLX3co3r3ktyZc9y2cHQ6Gha0b9aPZo=&xsec_source=pc_user,香港5店齐开🎉小蓝杯在香港营业啦,瑞幸咖啡香港昨天开业啦🎉 感谢大家的喜爱和支持,"瑞幸咖啡香港开业, 瑞幸咖啡",2024-12-29,未知,174,29,46
https://www.xiaohongshu.com/explore/67700fa600000000130084a6?xsec_token=ABb93TSk31WtGClLX3co3r3swqAWsuelxT7GHWAqQe6eE=&xsec_source=pc_user,点击解锁易烊千玺映前广告原视频,看到大家最近在影院里🎦 解锁了易烊千玺的暖冬新视频 小瑞赶紧发来原视频 快来接收这份冬日小温暖吧,"易烊千玺的费尔岛拿铁, 易烊千玺代言瑞幸咖啡, 冬天就喝烤椰拿铁, 电影小小的我",2024-12-29,未知,6502,536,319
https://www.xiaohongshu.com/explore/676e8969000000000900cd94?xsec_token=ABIda3D28pICc2COIFe-TDNr7RQARrC11DozkvHCs7xss=&xsec_source=pc_user,褚橙拿铁，明天见🍊,新一年，甜刚好 褚橙拿铁，明天见！ 	 ﻿﻿ ﻿﻿ ﻿﻿,"瑞幸咖啡, 褚橙拿铁, 瑞幸联名褚橙",2024-12-29,未知,812,102,816
https://www.xiaohongshu.com/explore/676ee24300000000090154c4?xsec_token=ABIda3D28pICc2COIFe-TDNuZjpoxLQHLswE-Y9pfoH5o=&xsec_source=pc_user,你好，香港！,你好，香港！我们来啦 一起跟随镜头寻找幸运吧！,瑞幸咖啡香港开业,2024-12-28,未知,1018,120,116
https://www.xiaohongshu.com/explore/676ed2d6000000000902c773?xsec_token=ABIda3D28pICc2COIFe-TDNq1Af7Vj161Ffqq4lnUf3uo=&xsec_source=pc_user,瑞幸咖啡香港五店齐开！开张有礼🎁,香港，我们来啦🎉 香港五店齐开！开张有礼，幸运在握 香港的朋友们快来店里打卡吧！ 城市限定款周边也同步上线🛍两款限定纸袋 + 一款限定杯套 😍到店参加活动还可得限定贴纸&徽章～,瑞幸咖啡香港开业,2024-12-28,未知,665,213,400
https://www.xiaohongshu.com/explore/676e4f070000000009015816?xsec_token=ABIda3D28pICc2COIFe-TDNkjvbdp8MbHahlBV8xD0DkY=&xsec_source=pc_user,小小的我今日上映！解锁映前小惊喜🎁,今日上映🎬 小蓝杯和代言人一起登陆映前广告啦，看到记得合个影~ ps:电影最后找找小瑞~ 📍四大城市部分影院，解锁映前小惊喜~ 北京、上海、广州、深圳,"电影小小的我, 冬天就喝烤椰拿铁, 易烊千玺代言瑞幸咖啡, 易烊千玺的费尔岛拿铁",2024-12-27,未知,2709,216,803
